article_id,ticker,published_at,date,source_name,author,title,description,content,content_truncated,url,sentiment_score,sentiment_label,Open,High,Low,Close,Volume,Return_1D,MA_5,MA_21,MA_126,MA_252,Volatility_21
31,AMZN,2026-03-31T21:12:56Z,2026-03-31,NBCSports.com,Vaughn Dalzell,"NBA Predictions for Most Improved Player and Sixth Man of the Year: Keldon Johnson, Nickeil Alexander-Walker",Vaughn Dalzell predicts the NBA's Most Improved and Sixth Man of the Year markets.,"The NBA's postseason begins in two weeks and as the regular season wraps up, the awards market start to become one-way traffic. Two awards that are still up in the air are Sixth Man of the Year and M",True,https://www.nbcsports.com/betting/nba/news/nba-predictions-for-most-improved-player-and-sixth-man-of-the-year-keldon-johnson-nickeil-alexander-walker,0.7184,positive,204.8500061035156,210.27999877929688,204.13999938964844,208.2700042724609,58470100,0.0364270088847233,205.5619995117188,210.07142857142856,224.54444449288505,218.32908739362443,0.020916519864313
32,AMZN,2026-03-31T21:17:00Z,2026-03-31,Amazon.com,aws@amazon.com,Amazon OpenSearch Service introduces agentic AI for log analytics,Amazon OpenSearch Service now offers agentic AI capabilities that enable engineering and support teams to analyze log data through an agentic conversational interface. These agentic AI features help simplify log querying and accelerate incident investigations…,Amazon OpenSearch Service now offers agentic AI capabilities that enable engineering and support teams to analyze log data through an agentic conversational interface. These agentic AI features help,True,https://aws.amazon.com/about-aws/whats-new/2026/03/opensearch-agentic-ai-log-analytics-observability/,0.7269,positive,204.8500061035156,210.27999877929688,204.13999938964844,208.2700042724609,58470100,0.0364270088847233,205.5619995117188,210.07142857142856,224.54444449288505,218.32908739362443,0.020916519864313
33,AMZN,2026-03-31T21:17:03Z,2026-03-31,The Next Web,Cristian Dina,"OpenAI closes record $122 billion round at $852 billion valuation, opens door to retail investors for the first time","There is a number that keeps getting larger, and on Tuesday it got larger again. OpenAI announced that it had closed its latest funding round with $122 billion in committed capital, valuing the ChatGPT maker at $852 billion post-money. The figure is up from t…","There is a number that keeps getting larger, and on Tuesday it got larger again. OpenAI announced that it had closed its latest funding round with $122 billion in committed capital, valuing the ChatG",True,https://thenextweb.com/news/openai-122-billion-round-852-billion-valuation-retail-investors/,0.5859,positive,204.8500061035156,210.27999877929688,204.13999938964844,208.2700042724609,58470100,0.0364270088847233,205.5619995117188,210.07142857142856,224.54444449288505,218.32908739362443,0.020916519864313
34,AMZN,2026-03-31T21:20:42Z,2026-03-31,Slickdeals.net,pennysave,44mm Amazfit T-Rex 3 Pro Outdoor Smart Watch (Arctic Gold) $200 + Free S&H w/ Amazon Prime,Woot has 44mm Amazfit T-Rex 3 Pro Outdoor Smart Watch (Arctic Gold) for $199.99. Shipping is free for Amazon Prime Members (must login with your Amazon account and select a shipping address in order f,"if they ever make all the features work as advertised it will be a great dealhopefully will make Garmin rein in their insane prices
DC Rainmaker says Amazfit is good but not great
https://www.dcrai",True,https://slickdeals.net/f/19367778-199-99-new-amazfit-t-rex-3-pro-outdoor-smart-watch-44mm-arctic-gold-at-woot,-0.4197,negative,204.8500061035156,210.27999877929688,204.13999938964844,208.2700042724609,58470100,0.0364270088847233,205.5619995117188,210.07142857142856,224.54444449288505,218.32908739362443,0.020916519864313
35,AMZN,2026-03-31T21:21:15Z,2026-03-31,pymnts.com,PYMNTS,Tenex Raises $250 Million as AI Security Spending Accelerates,"Cybersecurity startup Tenex has raised $250 million in new funding at a valuation exceeding $1 billion. According to a Tuesday (March 31) Bloomberg report, the fundraise signaled continued investor demand for artificial intelligence (AI) tools that can defend…","Cybersecurity startup Tenex has raised $250 million in new funding at a valuation exceeding $1 billion.According to a Tuesday (March 31) Bloomberg report, the fundraise signaled continued investor de",True,https://www.pymnts.com/news/investment-tracker/2026/tenex-raises-250-million-as-ai-security-spending-accelerates/,0.0,neutral,204.8500061035156,210.27999877929688,204.13999938964844,208.2700042724609,58470100,0.0364270088847233,205.5619995117188,210.07142857142856,224.54444449288505,218.32908739362443,0.020916519864313
36,AMZN,2026-03-31T21:25:12Z,2026-03-31,Wired,"Dell Cameron, Louise Matsakis",Iran Threatens to Start Attacking Major US Tech Firms on April 1,"Tech giants like Apple, Google, and Microsoft are among those on a target list released by Iran’s Islamic Revolutionary Guard Corps.",Irans Islamic Revolutionary Guard Corps warned Tuesday that it plans to begin attacking more than a dozen American companies across the Middle East on Wednesday in retaliation for the killing of Iran,True,https://www.wired.com/story/iran-threatens-to-start-attacking-major-us-tech-firms-on-april-1/,-0.8591,negative,204.8500061035156,210.27999877929688,204.13999938964844,208.2700042724609,58470100,0.0364270088847233,205.5619995117188,210.07142857142856,224.54444449288505,218.32908739362443,0.020916519864313
37,AMZN,2026-03-31T21:25:43Z,2026-03-31,CNET,Meara Isenberg,You Can Now Shop for Amazon Items on Samsung TV Plus,Here's what to know about the Amazon Live FAST channel on the streaming service.,"If you own a Samsung device and your Amazon cart is looking a little bare, a new collaboration could help you fill it. Free streaming service Samsung TV Plus has added an Amazon Live FAST (free, ad-s",True,https://www.cnet.com/tech/services-and-software/you-can-now-shop-amazon-on-samsung-tv-plus/,0.8934,positive,204.8500061035156,210.27999877929688,204.13999938964844,208.2700042724609,58470100,0.0364270088847233,205.5619995117188,210.07142857142856,224.54444449288505,218.32908739362443,0.020916519864313
38,AMZN,2026-03-31T21:25:45Z,2026-03-31,Dealnews.com,Unknown,Open-Box Onn Gaming Headset for $9.90 + free shipping,"Use promo code ""VIPOUTLETMARCH"" for this price on this Onn gaming headset for a $20 low. Shipping is free. Deal ends April 1st at 3:00am ET. Buy Now at eBay
 Features
 <ul> <li>7.1 virtual surround sound mode</li> <li>7-color LED lighting mode</li> <li>Mode…","moreCheckout via the on-page lightning deal to save nearly 40% off, making these Sony headphones not only the best price we've seen, but their best ever price on Amazon. But act quickly! This deal is",True,https://www.dealnews.com/products/Onn/Gaming-Headset/498123.html,0.8425,positive,204.8500061035156,210.27999877929688,204.13999938964844,208.2700042724609,58470100,0.0364270088847233,205.5619995117188,210.07142857142856,224.54444449288505,218.32908739362443,0.020916519864313
39,AMZN,2026-03-31T21:28:26Z,2026-03-31,TechCrunch,Rebecca Bellan,"OpenAI, not yet public, raises $3B from retail investors in monster $122B fund raise | TechCrunch","OpenAI's latest funding round, led by Amazon, Nvidia, and SoftBank, values the AI lab at $852 billion as it nears an IPO.","OpenAI has closed a deal to raise $122 billion at an $852 billion valuation, its largest funding round to date as the company is expected to hit the public markets this year.
The round will add to O",True,https://techcrunch.com/2026/03/31/openai-not-yet-public-raises-3b-from-retail-investors-in-monster-122b-fund-raise/,0.0,neutral,204.8500061035156,210.27999877929688,204.13999938964844,208.2700042724609,58470100,0.0364270088847233,205.5619995117188,210.07142857142856,224.54444449288505,218.32908739362443,0.020916519864313
40,AMZN,2026-03-31T21:29:57Z,2026-03-31,Slickdeals.net,Red_Liz | Staff,"FLEXISPOT 100.4"" SF6 Cloud Modular Sectional Sofa w/ Storage Ottoman $300 + Free Shipping (3 replies)","FlexiSpot via Amazon [amazon.com] has FLEXISPOT 100.4"" SF6 Cloud Modular Sectional Sofa w/ Storage Ottoman for $599.99 - $300 off w/ code B9HR4I7N at checkout = $299.99. Shipping is free.

Produc","This collaborative space allows users to contribute additional information, tips, and insights to enhance the original deal post. Feel free to share your knowledge and help fellow shoppers make infor",True,https://slickdeals.net/f/19370082-flexispot-100-4-sf6-cloud-modular-sectional-sofa-w-storage-ottoman-300-free-shipping,0.8591,positive,204.8500061035156,210.27999877929688,204.13999938964844,208.2700042724609,58470100,0.0364270088847233,205.5619995117188,210.07142857142856,224.54444449288505,218.32908739362443,0.020916519864313
41,AMZN,2026-03-31T21:30:00Z,2026-03-31,ComicBook.com,Logan Moore,Nintendo Switch Exclusive Game From 2019 Taken Off eShop Without Warning,"A Nintendo Switch game that launched on the console in 2019 and has remained exclusive to the platform has suddenly been taken off the eShop. By all accounts, 2019 was one of the best years that the Switch saw throughout its life cycle. Games like Fire Emblem…","A Nintendo Switch game that launched on the console in 2019 and has remained exclusive to the platform has suddenly been taken off the eShop. By all accounts, 2019 was one of the best years that the",True,http://comicbook.com/gaming/news/nintendo-switch-games-2019-delisted-eshop/,0.7351,positive,204.8500061035156,210.27999877929688,204.13999938964844,208.2700042724609,58470100,0.0364270088847233,205.5619995117188,210.07142857142856,224.54444449288505,218.32908739362443,0.020916519864313
42,AMZN,2026-03-31T21:30:00Z,2026-03-31,New York Post,Angela Tricarico,I go to Disney World a lot — this is the only guide you’ll ever need to build your park bag,Save on all of these theme park essentials during Amazon's Big Spring Sale.,"New York Post may be compensated and/or receive an affiliate commission if you click or buy through our links. Featured pricing is subject to change.
I have this down to a science. 
As Post Wanted’",True,https://nypost.com/2026/03/31/shopping/theme-park-and-disney-world-essentials-to-shop-during-amazon-big-spring-sale/,0.0,neutral,204.8500061035156,210.27999877929688,204.13999938964844,208.2700042724609,58470100,0.0364270088847233,205.5619995117188,210.07142857142856,224.54444449288505,218.32908739362443,0.020916519864313
43,AMZN,2026-03-31T21:30:09Z,2026-03-31,Slickdeals.net,phoinix | Staff,$65.99 | GIGABYTE H810M Gaming WIFI6 Intel Core Ultra (Series 2) LGA 1851 Motherboard at Amazon (2 replies),"Amazon [amazon.com] has GIGABYTE H810M Gaming WIFI6 Intel Core Ultra (Series 2) LGA 1851 Motherboard for $65.99.
Shipping is free.

Price
$79 lower (54% savings) than the list price of $144.99
$21 low","This collaborative space allows users to contribute additional information, tips, and insights to enhance the original deal post. Feel free to share your knowledge and help fellow shoppers make infor",True,https://slickdeals.net/f/19370085-65-99-gigabyte-h810m-gaming-wifi6-intel-core-ultra-series-2-lga-1851-motherboard-at-amazon,0.8591,positive,204.8500061035156,210.27999877929688,204.13999938964844,208.2700042724609,58470100,0.0364270088847233,205.5619995117188,210.07142857142856,224.54444449288505,218.32908739362443,0.020916519864313
44,AMZN,2026-03-31T21:34:29Z,2026-03-31,Breitbart News,Breitbart News,Sophie Turner Injury Halts 'Tomb Raider' Filming,"(UPI) — Amazon MGM Studios had to pause filming on its much-anticipated new series Tomb Raider, starring Sophie Turner.
The post Sophie Turner Injury Halts ‘Tomb Raider’ Filming appeared first on Breitbart.","March 30 (UPI) Amazon MGM Studios had to pause filming on its much-anticipated new series Tomb Raider, starring Sophie Turner.
On Monday, in a statement to Deadline the studio said Sophie Turner rec",True,https://www.breitbart.com/entertainment/2026/03/31/sophie-turner-injury-halts-tomb-raider-filming/,0.1779,positive,204.8500061035156,210.27999877929688,204.13999938964844,208.2700042724609,58470100,0.0364270088847233,205.5619995117188,210.07142857142856,224.54444449288505,218.32908739362443,0.020916519864313
45,AMZN,2026-03-31T21:35:20Z,2026-03-31,CNET,Oscar Gonzalez,How to Watch the 1993 'Super Mario Bros.' Movie,Here's where to watch the original Mario Bros. movie that gives the impression that no one who made the film ever played the game.,"The Super Mario Galaxy Movie opens on Wednesday, and it will likely be another blockbuster hit for Nintendo, like its predecessor. That movie, however, wasn't the first time the Mario Bros. hit the b",True,https://www.cnet.com/tech/services-and-software/how-to-watch-the-1993-super-mario-bros-movie/,0.8834,positive,204.8500061035156,210.27999877929688,204.13999938964844,208.2700042724609,58470100,0.0364270088847233,205.5619995117188,210.07142857142856,224.54444449288505,218.32908739362443,0.020916519864313
46,AMZN,2026-03-31T21:36:24Z,2026-03-31,Page Six,Hannah Southwick,Kyle Richards swears by this under-$20 sports bra: ‘Holds everything in’,"Plus, the sneakers she loves so much, she buys ""two or three"" at a time.","Page Six may be compensated and/or receive an affiliate commission if you click or buy through our links. Featured pricing is subject to change.
Kyle Richards’ athleisure picks support her workout g",True,https://pagesix.com/2026/03/31/style/kyle-richards-swears-by-this-17-amazon-sports-bra-so-cute/,0.4019,positive,204.8500061035156,210.27999877929688,204.13999938964844,208.2700042724609,58470100,0.0364270088847233,205.5619995117188,210.07142857142856,224.54444449288505,218.32908739362443,0.020916519864313
47,AMZN,2026-03-31T21:39:01Z,2026-03-31,GamesRadar+,George Marston,"The Boys' final season is officially finished as creator Eric Kripke says farewell to ""the best professional experience of my life""",That's a wrap on production for The Boys season 5 as the show prepares to end its run,"The final episode of the final season of The Boys is a wrap. Showrunner Eric Kripke shared the news on his social media, declaring that production of The Boys season 5 is done, and therefore, so is t",True,https://www.gamesradar.com/entertainment/superhero-shows/the-boys-final-season-is-officially-finished-as-creator-eric-kripke-says-farewell-to-the-best-professional-experience-of-my-life/,0.34,positive,204.8500061035156,210.27999877929688,204.13999938964844,208.2700042724609,58470100,0.0364270088847233,205.5619995117188,210.07142857142856,224.54444449288505,218.32908739362443,0.020916519864313
48,AMZN,2026-03-31T21:40:00Z,2026-03-31,IGN,Noah Hunter,Last Chance: Save 25% On the Pokémon Movie Collection Blu-ray During the Amazon Spring Sale,Gotta catch this deal before it's too late!,"Amazon's Big Spring Sale is almost over, and now is the time to score deals before the sale ends tomorrow. While the '3 for 2' deal for movies, books, and vinyl has ended, there are still some great",True,https://www.ign.com/articles/the-pokemon-movie-collection-blu-ray-deal-amazon-spring-sale-2026,0.6249,positive,204.8500061035156,210.27999877929688,204.13999938964844,208.2700042724609,58470100,0.0364270088847233,205.5619995117188,210.07142857142856,224.54444449288505,218.32908739362443,0.020916519864313
49,AMZN,2026-03-31T21:43:02Z,2026-03-31,ZDNet,Nina Raemont,This minimalist smartwatch by one of my favorite tech companies is under $100 right now,"On the final day of Amazon's Spring Sale, grab the CMF by Nothing Watch Pro 3 for $69.","CMF/ZDNET
Follow ZDNET: Add us as a preferred source on Google.
I don't have much tech on my wishlist these days - it's a blessing as a tech reviewer to test out every new gadget. But one product I",True,https://www.zdnet.com/article/this-minimalist-smartwatch-by-one-of-my-favorite-tech-companies-is-under-100-right-now/,0.2732,positive,204.8500061035156,210.27999877929688,204.13999938964844,208.2700042724609,58470100,0.0364270088847233,205.5619995117188,210.07142857142856,224.54444449288505,218.32908739362443,0.020916519864313
50,AMZN,2026-03-31T21:45:00Z,2026-03-31,IGN,Danielle Abraham,Apple AirPods Max Are $150 Off at Woot,Don’t miss your chance to snag these top-tier noise-canceling headphones back at their lowest price,"Its your last chance to save during Amazons Big Spring Sale
. However, its not the only place where you can score some awesome discounts. Woot, the Amazon-owned deals website, has plenty of items av",True,https://www.ign.com/articles/apple-airpods-max-are-150-off-at-woot,0.9001,positive,204.8500061035156,210.27999877929688,204.13999938964844,208.2700042724609,58470100,0.0364270088847233,205.5619995117188,210.07142857142856,224.54444449288505,218.32908739362443,0.020916519864313
51,AMZN,2026-03-31T21:46:00Z,2026-03-31,PCMag.com,Michael Kan,Amazon Leo to Test Custom Satellite Dish With Israeli Firm,"The test would involve an Israeli company called Get SAT, which sells satellite antenna equipment to clients, including defense groups and enterprises.
Amazon has been working with an Israeli company on a custom antenna to connect to the company’s Starlink ch…","Amazon has been working with an Israeli company on a custom antenna to connect to the companys Starlink challenger, Leo. 
In a filing last week with the Federal Communications Commission, Amazon ask",True,https://uk.pcmag.com/networking/164167/amazon-leo-to-test-custom-satellite-dish-with-israeli-firm,0.4404,positive,204.8500061035156,210.27999877929688,204.13999938964844,208.2700042724609,58470100,0.0364270088847233,205.5619995117188,210.07142857142856,224.54444449288505,218.32908739362443,0.020916519864313
52,AMZN,2026-03-31T21:46:00Z,2026-03-31,PCMag.com,Michael Kan,Amazon Leo to Test Custom Satellite Dish With Israeli Firm,"The test would involve an Israeli company called Get SAT, which sells satellite antenna equipment to clients, including defense groups and enterprises.
Amazon has been working with an Israeli company on a custom antenna to connect to the company’s Starlink ch…","Amazon has been working with an Israeli company on a custom antenna to connect to the companys Starlink challenger, Leo. 
In a filing last week with the Federal Communications Commission, Amazon ask",True,https://me.pcmag.com/en/networking/36316/amazon-leo-to-test-custom-satellite-dish-with-israeli-firm,0.4404,positive,204.8500061035156,210.27999877929688,204.13999938964844,208.2700042724609,58470100,0.0364270088847233,205.5619995117188,210.07142857142856,224.54444449288505,218.32908739362443,0.020916519864313
53,AMZN,2026-03-31T21:46:09Z,2026-03-31,Slickdeals.net,phoinix,"[AC] $16.14 | 2 × 1kg SUNLU ABS Like Resin for 3D Printer, 405nm UV Curing Photopolymer Rapid 3D Resin ($8.07 each) at Amazon","SUNLU-US via Amazon [amazon.com] has 1kg SUNLU ABS Like Resin for 3D Printer, 405nm UV Curing Photopolymer Rapid 3D Resin 2 for $32.28 - (multibuy discount) = $16.14.
Shipping is free with Prime or on","This collaborative space allows users to contribute additional information, tips, and insights to enhance the original deal post. Feel free to share your knowledge and help fellow shoppers make infor",True,https://slickdeals.net/f/19370121-ac-16-14-2-1kg-sunlu-abs-like-resin-for-3d-printer-405nm-uv-curing-photopolymer-rapid-3d-resin-8-07-each-at-amazon,0.8591,positive,204.8500061035156,210.27999877929688,204.13999938964844,208.2700042724609,58470100,0.0364270088847233,205.5619995117188,210.07142857142856,224.54444449288505,218.32908739362443,0.020916519864313
54,AMZN,2026-03-31T21:50:53Z,2026-03-31,Slickdeals.net,babgaly | Staff,"68"" QiMH Industrial Stepless Dimmable Tree Floor Lamp w/ 3 LED Bulbs $34.99 + Free Shipping w/ Prime or on $35+ (0 replies)","QiMH via Amazon [amazon.com] has 68"" QiMH Industrial Stepless Dimmable Tree Floor Lamp w/ 3 LED Bulbs (Gold) on sale for $49.99 - $15 off when you enter the coupon code G9SR62ZU =$34.99. Shipping","This collaborative space allows users to contribute additional information, tips, and insights to enhance the original deal post. Feel free to share your knowledge and help fellow shoppers make infor",True,https://slickdeals.net/f/19370130-68-qimh-industrial-stepless-dimmable-tree-floor-lamp-w-3-led-bulbs-34-99-free-shipping-w-prime-or-on-35,0.8591,positive,204.8500061035156,210.27999877929688,204.13999938964844,208.2700042724609,58470100,0.0364270088847233,205.5619995117188,210.07142857142856,224.54444449288505,218.32908739362443,0.020916519864313
55,AMZN,2026-03-31T21:52:15Z,2026-03-31,Slickdeals.net,KUJayhawk08,"Armaf Odyssey Mega Limited Edition for Men Eau de Parfum Spray, 3.4 Ounce (Clone of YSL Y EDP) $20.99","Clone of YSL Y EDP. 
 
Shipped and sold by Amazon. 
 
https://www.amazon.com/ARMAF-Odys...B0CGDQKQDJ 
 
https://www.fragrantica.com/perfu...83133.html","This collaborative space allows users to contribute additional information, tips, and insights to enhance the original deal post. Feel free to share your knowledge and help fellow shoppers make infor",True,https://slickdeals.net/f/19370136-armaf-odyssey-mega-limited-edition-for-men-eau-de-parfum-spray-3-4-ounce-clone-of-ysl-y-edp-20-99-at-amazon,0.8591,positive,204.8500061035156,210.27999877929688,204.13999938964844,208.2700042724609,58470100,0.0364270088847233,205.5619995117188,210.07142857142856,224.54444449288505,218.32908739362443,0.020916519864313
56,AMZN,2026-03-31T21:59:22Z,2026-03-31,Dealnews.com,Unknown,De'Longhi Big Spring Sale at Amazon: Up to 40% off + free shipping,Amazon's Big Spring Sale includes De'Longhi espresso machines marked 15% to 40% off. The pictured De'Longhi Dedica Maestro Plus Espresso Machine is $299.93 ($200 off). Sale ends March 31. Shop Now at Amazon,"moreYou'd pay $200 for this same Ninja PossibleCooker PRO Plus today at Amazon, so this is an amazing price at Walmart. It's also the best deal we've ever seen for this model. Shipping is free, too.",True,https://www.dealnews.com/De-Longhi-Big-Spring-Sale-at-Amazon-Up-to-40-off-free-shipping/21819529.html,0.9118,positive,204.8500061035156,210.27999877929688,204.13999938964844,208.2700042724609,58470100,0.0364270088847233,205.5619995117188,210.07142857142856,224.54444449288505,218.32908739362443,0.020916519864313
57,AMZN,2026-03-31T21:59:47Z,2026-03-31,The Verge,Sheena Vasani,You can grab a four-pack of Govee’s color-changing smart bulbs for just $27,"Spring cleaning isn’t just about clearing things out. It’s also a chance to refresh your living space, and a simple place to start is smart lighting — specifically, Govee’s Smart A19 LED Light Bulbs. The color-changing bulbs can instantly change the vibe of y…","<ul><li></li><li></li><li></li></ul>
The Matter-compatible smart lights can sync to music or illuminate any living space with more than 16 million colors.
The Matter-compatible smart lights can syn",True,https://www.theverge.com/gadgets/904698/govee-smart-a19-led-color-bulbs-amazon-big-spring-sale-2026-deal,0.6597,positive,204.8500061035156,210.27999877929688,204.13999938964844,208.2700042724609,58470100,0.0364270088847233,205.5619995117188,210.07142857142856,224.54444449288505,218.32908739362443,0.020916519864313
58,AMZN,2026-03-31T21:59:52Z,2026-03-31,Slickdeals.net,phoinix,"$1719.99 | APC Smart-UPS 1500VA Lithium Ion UPS, SMTL1500RM3UCNC at Amazon","Amazon [amazon.com] has *APC Smart-UPS 1500VA Lithium Ion UPS, SMTL1500RM3UCNC* for *$1719.99*. 
*Shipping is free*. 
 
*Price* 
*$667.14* lower (28% savings) than the *typical* price of *$2387.13*...","This collaborative space allows users to contribute additional information, tips, and insights to enhance the original deal post. Feel free to share your knowledge and help fellow shoppers make infor",True,https://slickdeals.net/f/19370142-1719-99-apc-smart-ups-1500va-lithium-ion-ups-smtl1500rm3ucnc-at-amazon,0.8591,positive,204.8500061035156,210.27999877929688,204.13999938964844,208.2700042724609,58470100,0.0364270088847233,205.5619995117188,210.07142857142856,224.54444449288505,218.32908739362443,0.020916519864313
59,AMZN,2026-03-31T22:00:00Z,2026-03-31,TechRadar,"jacob.krol@futurenet.com (Jacob Krol) , Jacob Krol","Delta is finally joining the faster satellite Wi-Fi craze with Amazon — but if you want in-flight satellite now, you’ll still want to book United","Delta Air Lines is bringing faster, satellite-powered Wi-Fi to its planes via Amazon’s Leo network — but with the rollout not starting until 2028, United Airlines remains the better bet for high-speed connectivity right now.","<ul><li>Delta is partnering with Amazon’s LEO for faster, satellite-powered in-flight Wi-Fi</li><li>Installs will start in 2028 on 500 aircraft types</li><li>United still leads for now with Starlink",True,https://www.techradar.com/computing/internet/delta-is-finally-joining-the-faster-satellite-wi-fi-craze-with-amazon-but-if-you-want-in-flight-satellite-now-youll-still-want-to-book-united,0.0,neutral,204.8500061035156,210.27999877929688,204.13999938964844,208.2700042724609,58470100,0.0364270088847233,205.5619995117188,210.07142857142856,224.54444449288505,218.32908739362443,0.020916519864313
