article_id,ticker,published_at,date,source_name,author,title,description,content,content_truncated,url,sentiment_score,sentiment_label,Open,High,Low,Close,Volume,Return_1D,MA_5,MA_21,MA_126,MA_252,Volatility_21
60,AMZN,2026-03-31T22:00:00Z,2026-03-31,GeekTyrant,Joey Paur,"PROJECT HAIL MARY Hits $300 Million, SCREAM 7 Crosses $200 Million, and THEY WILL KILL YOU Bombs","Project Hail Mary has officially cleared $300 million at the global box office, landing at $300.8 million worldwide and cementing itself as the highest-grossing film in Amazon MGM's history. That knocks Creed III off its throne, the 2023 boxing sequel had hel…","Project Hail Maryhas officially cleared $300 million at the global box office, landing at $300.8 million worldwide and cementing itself as the highest-grossing film in Amazon MGM's history. 
That kn",True,https://geektyrant.com/news/project-hail-mary-hits-300-million-scream-7-crosses-200-million-and-they-will-kill-you-bombs,0.34,positive,204.8500061035156,210.27999877929688,204.13999938964844,208.2700042724609,58470100,0.0364270088847233,205.5619995117188,210.07142857142856,224.54444449288505,218.32908739362443,0.020916519864313
61,AMZN,2026-03-31T22:01:48Z,2026-03-31,The Next Web,Allison Steffens Herrera,Iran’s Revolutionary Guards just named 18 US tech firms as military targets. The age of the civilian data centre is over.,"At 8pm Tehran time on Tuesday, a new kind of front line was drawn, not through desert terrain or along a disputed border, but through the server farms, cloud regions, and corporate campuses of America’s largest technology companies. The Islamic Revolutionary …","At 8pm Tehran time on Tuesday, a new kind of front line was drawn, not through desert terrain or along a disputed border, but through the server farms, cloud regions, and corporate campuses of Americ",True,https://thenextweb.com/news/iran-irgc-18-us-tech-companies-military-targets/,-0.1779,negative,204.8500061035156,210.27999877929688,204.13999938964844,208.2700042724609,58470100,0.0364270088847233,205.5619995117188,210.07142857142856,224.54444449288505,218.32908739362443,0.020916519864313
62,AMZN,2026-03-31T22:03:21Z,2026-03-31,Forbes,"Alyssa Jaffer, Contributor, 
 Alyssa Jaffer, Contributor
 https://www.forbes.com/sites/alyssajaffer/",‘Scarpetta’ Creator Liz Sarnoff On Centering Women On The Silver Screen,Emmy nominated executive producer Liz Sarnoff shares the importance of creating women led stories in Hollywood.,"Kay Scarpetta (Nicole Kidman) 
Connie Chornuk/Prime
You may have binged the new drama series Scarpetta starring Nicole Kidman this month, the latest series from nine-time Emmy-nominated television",True,https://www.forbes.com/sites/alyssajaffer/2026/03/31/scarpetta-creator-liz-sarnoff-on-centering-women-with-agency-on-the-silver-screen/,0.0,neutral,204.8500061035156,210.27999877929688,204.13999938964844,208.2700042724609,58470100,0.0364270088847233,205.5619995117188,210.07142857142856,224.54444449288505,218.32908739362443,0.020916519864313
63,AMZN,2026-03-31T22:05:35Z,2026-03-31,Amazon.com,Unknown,AWS App Runner availability change - AWS App Runner,"AWS App Runner will no longer be open to new customers starting April 30, 2026. If you would like to use App Runner, sign up prior to that date. Existing customers can continue to use the service as normal. For more information, see AWS App Runner availabilit…","AWS App Runner will no longer be open to new customers starting April 30, 2026. If you would like to use
 App Runner, sign up prior to that date. Existing customers can continue to use the service a",True,https://docs.aws.amazon.com/apprunner/latest/dg/apprunner-availability-change.html,0.0772,positive,204.8500061035156,210.27999877929688,204.13999938964844,208.2700042724609,58470100,0.0364270088847233,205.5619995117188,210.07142857142856,224.54444449288505,218.32908739362443,0.020916519864313
64,AMZN,2026-03-31T22:06:09Z,2026-03-31,New York Post,Angela Tricarico,"The Big Spring Sale ends in a few hours, but these Sony headphones are still at their lowest price ever","The noise cancellation on these is so good, I missed my train getting diverted.","New York Post may be compensated and/or receive an affiliate commission if you click or buy through our links. Featured pricing is subject to change.
It’s been a great week of deals, but Amazon’s Bi",True,https://nypost.com/2026/03/31/shopping/get-sony-xm5-headphones-at-lowest-price-ever-during-amazon-spring-sale/,0.3716,positive,204.8500061035156,210.27999877929688,204.13999938964844,208.2700042724609,58470100,0.0364270088847233,205.5619995117188,210.07142857142856,224.54444449288505,218.32908739362443,0.020916519864313
65,AMZN,2026-03-31T22:06:58Z,2026-03-31,MarketBeat,MarketBeat,BioHarvest Sciences Q4 Earnings Call Highlights,"BioHarvest Sciences (NASDAQ:BHST) reported fourth-quarter revenue of $9.1 million, up 25% year-over-year and within management’s guidance range, as the...","Operating expenses in the fourth quarter were $6.3 million, compared with $5.8 million in the year-ago period, which Dichter attributed primarily to increased marketing spend and higher expenses from",True,https://www.marketbeat.com/instant-alerts/bioharvest-sciences-q4-earnings-call-highlights-2026-03-31/?utm_source=yahoofinance&amp;utm_medium=yahoofinance,0.2732,positive,204.8500061035156,210.27999877929688,204.13999938964844,208.2700042724609,58470100,0.0364270088847233,205.5619995117188,210.07142857142856,224.54444449288505,218.32908739362443,0.020916519864313
66,AMZN,2026-03-31T22:11:23Z,2026-03-31,Amazon.com,Akarsha Sehwag,Build reliable AI agents with Amazon Bedrock AgentCore Evaluations,"In this post, we introduce Amazon Bedrock AgentCore Evaluations, a fully managed service for assessing AI agent performance across the development lifecycle. We walk through how the service measures agent accuracy across multiple quality dimensions. We explai…","Your AI agent worked in the demo, impressed stakeholders, handled test scenarios, and seemed ready for production. Then you deployed it, and the picture changed. Real users experienced wrong tool cal",True,https://aws.amazon.com/blogs/machine-learning/build-reliable-ai-agents-with-amazon-bedrock-agentcore-evaluations/,0.3612,positive,204.8500061035156,210.27999877929688,204.13999938964844,208.2700042724609,58470100,0.0364270088847233,205.5619995117188,210.07142857142856,224.54444449288505,218.32908739362443,0.020916519864313
67,AMZN,2026-03-31T22:15:44Z,2026-03-31,Twistedsifter.com,Sarrah Murtaza,"IT Expert Freaked Out Because His Computer Started Acting Weird, But Then He Found Out His Receptionist Was Behind The System Failure",So many tech stories end this way.,"Pexels/Reddit
Sometimes you can run around looking for the culprit only to find them nearby!
This user shares how he almost thought his computer was being hacked until he figured out the issue!
Ch",True,http://twistedsifter.com/2026/03/it-expert-freaked-out-because-his-computer-started-acting-weird-but-then-he-found-out-his-receptionist-was-behind-the-system-failure/,-0.2695,negative,204.8500061035156,210.27999877929688,204.13999938964844,208.2700042724609,58470100,0.0364270088847233,205.5619995117188,210.07142857142856,224.54444449288505,218.32908739362443,0.020916519864313
68,AMZN,2026-03-31T22:19:07Z,2026-03-31,ZDNet,Kayla Solino,These 5 Amazon Spring Sale deals are worth a second glance before they're gone soon,"It's the last day of Amazon's Big Spring Sale, but there's still last chance savings on top gear from Dyson (including vacuums, hair tools, and more).","ZDNET's recommendations are based on many hours of testing, research, and comparison shopping. We gather data from the best available sources, including vendor and retailer listings as well as other",True,https://www.zdnet.com/home-and-office/dyson-amazon-spring-sale-2026-deals-still-live/,0.743,positive,204.8500061035156,210.27999877929688,204.13999938964844,208.2700042724609,58470100,0.0364270088847233,205.5619995117188,210.07142857142856,224.54444449288505,218.32908739362443,0.020916519864313
69,AMZN,2026-03-31T22:20:37Z,2026-03-31,Page Six,Erica Radol,Hailey Bieber swapped her Levi’s 501 jeans for this style — and it’s majorly marked down today,The Rhode founder practically lives in her Levi's.,"Page Six may be compensated and/or receive an affiliate commission if you click or buy through our links. Featured pricing is subject to change.
Nail the off-duty model look for less.
Hailey Bieber",True,https://pagesix.com/2026/03/31/style/hailey-bieber-levis-ribcage-jeans-are-majorly-marked-down-at-amazon/,0.0,neutral,204.8500061035156,210.27999877929688,204.13999938964844,208.2700042724609,58470100,0.0364270088847233,205.5619995117188,210.07142857142856,224.54444449288505,218.32908739362443,0.020916519864313
70,AMZN,2026-03-31T22:25:38Z,2026-03-31,iPhone in Canada,IIC Deals,Final Hours: Grab These Amazon Spring Tech Deals Before They Vanish in Canada,"Amazon’s week-long Big Spring Sale is officially entering its final hours. The event, which began on March 25, is scheduled to end tonight, March 31, at 11:59 p.m. PDT. This marks the last opportunity for shoppers to access discounted pricing across several m…","Want to see more of our stories on Google?
P.S. Want to keep this site truly independent? Support us by buying us a beer, treating us to a coffee, or shopping through Amazon here. Links in this post",True,https://www.iphoneincanada.ca/2026/03/31/final-hours-grab-these-amazon-big-spring-sale-tech-deals-before-they-vanish-in-canada/,0.8053,positive,204.8500061035156,210.27999877929688,204.13999938964844,208.2700042724609,58470100,0.0364270088847233,205.5619995117188,210.07142857142856,224.54444449288505,218.32908739362443,0.020916519864313
71,AMZN,2026-03-31T22:28:48Z,2026-03-31,pymnts.com,PYMNTS,OpenAI Valued at $852 Billion in Latest Funding Round,"OpenAI raised $122 billion in a funding round that valued it at $852 billion, the company said in a Tuesday (March 31) press release. The company also announced in the release that it is developing a “unified AI superapp” and that its enterprise business will…","OpenAI raised $122 billion in a funding round that valued it at $852 billion, the company said in a Tuesday (March 31) press release.The company also announced in the release that it is developing a",True,https://www.pymnts.com/artificial-intelligence-2/2026/openai-valued-at-852-billion-in-latest-funding-round/,0.4404,positive,204.8500061035156,210.27999877929688,204.13999938964844,208.2700042724609,58470100,0.0364270088847233,205.5619995117188,210.07142857142856,224.54444449288505,218.32908739362443,0.020916519864313
72,AMZN,2026-03-31T22:28:57Z,2026-03-31,Www.df.cl,Diario Financiero,IA soberana en Chile: la decisión de US$ 2 billones de la que nadie habla,"DARÍO PAYA CARL MEACHAM Western Hemisphere Business Development, Hydra Host Inc. An NVIDIA Cloud Partner","Un país tiene petróleo o no. La geología impuso esa realidad que nos ha marcado por décadas. Hoy pasa algo sin precedentes: por primera vez, un país puede elegir si será productor o simplemente consu",True,https://www.df.cl/opinion/columnistas/ia-soberana-en-chile-la-decision-de-us-2-billones-de-la-que-nadie-habla,-0.296,negative,204.8500061035156,210.27999877929688,204.13999938964844,208.2700042724609,58470100,0.0364270088847233,205.5619995117188,210.07142857142856,224.54444449288505,218.32908739362443,0.020916519864313
73,AMZN,2026-03-31T22:30:00Z,2026-03-31,Decider,mliss1578,"Stream It Or Skip It: ‘Wuthering Heights’ on VOD, an Extremely Horny Riff On A Literary Classic Starring Margot Robbie and Jason Elordi","Emerald Fennell follows up Saltburn with a sloppy, but entertaining adaptation of Emily Bronte’s classic romance.","So are we drinking the Wuthering Heights (now streaming on VOD platforms like Amazon Prime Video) bathwater, or are we scowling at it in disgust? Thats the question of the day, my friends. Hot-button",True,https://decider.com/2026/03/31/wuthering-heights-2026-stream-it-or-skip-it/,0.34,positive,204.8500061035156,210.27999877929688,204.13999938964844,208.2700042724609,58470100,0.0364270088847233,205.5619995117188,210.07142857142856,224.54444449288505,218.32908739362443,0.020916519864313
74,AMZN,2026-03-31T22:32:02Z,2026-03-31,Ozbargain.com.au,drclu,Roborock Saros 10R Robotic Vacuum Cleaner $1687 Delivered @ Amazon AU,"Have been looking at something to replace my terrible ecovacs, saw this deal. Maybe not ATL but lowest atm. Want to get from Amazon for their returns. So many of these 'tangle free' …","This post contains affiliate links. OzBargain might earn commissions when you click through and make purchases. Please see this page for more information.
Have been looking at something to replace m",True,https://www.ozbargain.com.au/node/954118,0.3182,positive,204.8500061035156,210.27999877929688,204.13999938964844,208.2700042724609,58470100,0.0364270088847233,205.5619995117188,210.07142857142856,224.54444449288505,218.32908739362443,0.020916519864313
75,AMZN,2026-03-31T22:32:34Z,2026-03-31,ZDNet,Kayla Solino,These Shark Amazon Spring Sale deals are perfect for a spring refresh - but hurry,"Amazon's Big Spring Sale ends today, but there's still plenty of savings from Shark (including hair tools, cleaning gear, and more) - but don't wait.","ZDNET's recommendations are based on many hours of testing, research, and comparison shopping. We gather data from the best available sources, including vendor and retailer listings as well as other",True,https://www.zdnet.com/home-and-office/shark-amazon-spring-sale-2026-deals-last-chance/,0.743,positive,204.8500061035156,210.27999877929688,204.13999938964844,208.2700042724609,58470100,0.0364270088847233,205.5619995117188,210.07142857142856,224.54444449288505,218.32908739362443,0.020916519864313
76,AMZN,2026-03-31T22:36:28Z,2026-03-31,Slickdeals.net,tDames | Staff,BlueDriver Bluetooth Professional OBDII Scan Tool $74.94 + Free Shipping (2 replies),"Lemur Vehicle Monitors via Amazon [amazon.com] has BlueDriver Bluetooth Professional OBDII Scan Tool on sale for $74.94. Shipping is free.

Product Description from Amazon:Pro OBD2 Scanner - BlueDrive","This collaborative space allows users to contribute additional information, tips, and insights to enhance the original deal post. Feel free to share your knowledge and help fellow shoppers make infor",True,https://slickdeals.net/f/19370202-bluedriver-bluetooth-professional-obdii-scan-tool-74-94-free-shipping,0.8591,positive,204.8500061035156,210.27999877929688,204.13999938964844,208.2700042724609,58470100,0.0364270088847233,205.5619995117188,210.07142857142856,224.54444449288505,218.32908739362443,0.020916519864313
77,AMZN,2026-03-31T22:37:58Z,2026-03-31,Variety,Jazztangcay,‘Project Hail Mary’ Cinematographer Greig Fraser on How He Created the Sun Effect to Light the Tunnel Scene,"Cinematographer Greig Fraser counts “The Batman,” “Dune” and “Rogue One” among his credits. But his latest film, “Project Hail Mary,” is what he calls his “most challenging film I’ve ever done, by far.” “Project Hail Mary” is based on Andy Weir’s book of the …","Cinematographer Greig Fraser counts “The Batman,” “Dune” and “Rogue One” among his credits. But his latest film, “Project Hail Mary,” is what he calls his “most challenging film I’ve ever done, by fa",True,https://variety.com/2026/artisans/features/project-hail-mary-cinematography-greig-fraser-tunnel-scene-1236703573/,0.4767,positive,204.8500061035156,210.27999877929688,204.13999938964844,208.2700042724609,58470100,0.0364270088847233,205.5619995117188,210.07142857142856,224.54444449288505,218.32908739362443,0.020916519864313
78,AMZN,2026-03-31T22:44:27Z,2026-03-31,The Verge,Brandon Widder,Amazon is offering up to 50 percent off chargers from Anker and others for its Big Spring Sale,"Amazon’s Big Spring Sale may not have been as “big” as Black Friday or even Prime Day, but depending on what you’re after, the discounts are more appealing than you might think. Take charging accessories, for instance. Anker, Twelve South, Baseus, and others …","Amazon’s Big Spring Sale may not have been as “big” as Black Friday or even Prime Day, but depending on what you’re after, the discounts are more appealing than you might think. Take charging accesso",True,https://www.theverge.com/gadgets/904242/amazon-big-spring-sale-2026-baseus-anker-chargers-power-banks-batteries-deals,0.0,neutral,204.8500061035156,210.27999877929688,204.13999938964844,208.2700042724609,58470100,0.0364270088847233,205.5619995117188,210.07142857142856,224.54444449288505,218.32908739362443,0.020916519864313
79,AMZN,2026-03-31T22:45:00Z,2026-03-31,"HITC - Football, Gaming, Movies, TV, Music",James Shearman,Dan Rapaport explains why he has so much respect for Rory McIlroy’s caddie Harry Diamond,"Rory McIlroy is once again in focus ahead of The Masters. A new Amazon Prime documentary, The Masters Wait, has just been released, charting the Northern Irishman’s 14-year journey to finally winning at Augusta in 2025.","Rory McIlroy is once again in focus ahead of The Masters.
A new Amazon Prime documentary, The Masters Wait, has just been released, charting the Northern Irishmans 14-year journey to finally winning",True,https://www.hitc.com/dan-rapaport-explains-why-he-has-so-much-respect-for-rory-mcilroys-caddie-harry-diamond/,0.1779,positive,204.8500061035156,210.27999877929688,204.13999938964844,208.2700042724609,58470100,0.0364270088847233,205.5619995117188,210.07142857142856,224.54444449288505,218.32908739362443,0.020916519864313
80,AMZN,2026-03-31T22:45:51Z,2026-03-31,ComicBook.com,Michael Leri,New AAA Lord of the Rings Game Reportedly in Development,"Image Courtesy of Warner Bros. Interactive Entertainment

There have been a few The Lord of the Rings games over the years — Tales of the Shire, Gollum, and Return to Moria — but none have been as big as the two games from the now-closed studio Monolith Produ…","There have been a few The Lord of the Rings games over the years Tales of the Shire, Gollum, and Return to Moria but none have been as big as the two games from the now-closed studio Monolith Product",True,http://comicbook.com/gaming/news/new-aaa-lord-of-the-rings-game-reportedly-in-development/,0.0,neutral,204.8500061035156,210.27999877929688,204.13999938964844,208.2700042724609,58470100,0.0364270088847233,205.5619995117188,210.07142857142856,224.54444449288505,218.32908739362443,0.020916519864313
81,AMZN,2026-03-31T22:49:07Z,2026-03-31,Slickdeals.net,Dmytro_B,DEWALT 20V MAX Heat Gun w/ Flat & Hook Nozzle Attachments (Tool Only) $99.15 + Free S&H,"Amazon has DEWALT 20V MAX Cordless Compact Heat Gun with Flat and Hook Nozzle Attachments (Tool Only, DCE530B) for $99.14. Shipping is free.

Thanks to Community Member Dmytro_B for finding this dea","This collaborative space allows users to contribute additional information, tips, and insights to enhance the original deal post. Feel free to share your knowledge and help fellow shoppers make infor",True,https://slickdeals.net/f/19369956-dewalt-20v-max-heat-gun-w-flat-hook-nozzle-attachments-tool-only-99-15-free-s-h,0.8591,positive,204.8500061035156,210.27999877929688,204.13999938964844,208.2700042724609,58470100,0.0364270088847233,205.5619995117188,210.07142857142856,224.54444449288505,218.32908739362443,0.020916519864313
82,AMZN,2026-03-31T22:52:31Z,2026-03-31,Techpowerup.com,Cpt.Jank,New 'The Lord of the Rings' RPG in Development at Crystal Dynamics,"There were rumors of a new The Lord of the Rings game in development late in 2025, but not much else was known about it other than that it had a sizeable budget of around $100 million and was to compete with Hogwarts Legacy when it came to game design and mec…","This should only take a few seconds. If you have issues, please do contact us, we want to learn about any problems.
Drag the handle to the target
Need help? Contact Us. Please mention your IP: 66.7",True,https://www.techpowerup.com/347917/new-the-lord-of-the-rings-rpg-in-development-at-crystal-dynamics,0.4588,positive,204.8500061035156,210.27999877929688,204.13999938964844,208.2700042724609,58470100,0.0364270088847233,205.5619995117188,210.07142857142856,224.54444449288505,218.32908739362443,0.020916519864313
83,AMZN,2026-03-31T22:53:05Z,2026-03-31,Slickdeals.net,idk_then,JLab Go Air Pop+ True Wireless Bluetooth Earbuds (Mint or White) $16.99 + Free Shipping w/ Prime or on $35+,"JLab Store via Amazon [amazon.com] has JLab Go Air Pop+ True Wireless Bluetooth Earbuds (2 Colors)  for $16.99. Shipping is free w/ Prime or on $35+.

Available Colors:Mint [amazon.com] $16.99
White [","This collaborative space allows users to contribute additional information, tips, and insights to enhance the original deal post. Feel free to share your knowledge and help fellow shoppers make infor",True,https://slickdeals.net/f/19370235-jlab-go-air-pop-true-wireless-bluetooth-earbuds-mint-or-white-16-99-free-shipping-w-prime-or-on-35,0.8591,positive,204.8500061035156,210.27999877929688,204.13999938964844,208.2700042724609,58470100,0.0364270088847233,205.5619995117188,210.07142857142856,224.54444449288505,218.32908739362443,0.020916519864313
84,AMZN,2026-03-31T22:58:13Z,2026-03-31,Amazon.com,Janardhan Molumuri,Leverage Agentic AI for Autonomous Incident Response with AWS DevOps Agent,"Introduction Teams running distributed workloads face a persistent operational challenge: when something breaks, the information needed to resolve it is scattered across logs, deployment pipelines, configuration histories, and third-party monitoring tools. A …","Introduction
Teams running distributed workloads face a persistent operational challenge: when something breaks, the information needed to resolve it is scattered across logs, deployment pipelines,",True,https://aws.amazon.com/blogs/devops/leverage-agentic-ai-for-autonomous-incident-response-with-aws-devops-agent/,0.4404,positive,204.8500061035156,210.27999877929688,204.13999938964844,208.2700042724609,58470100,0.0364270088847233,205.5619995117188,210.07142857142856,224.54444449288505,218.32908739362443,0.020916519864313
85,AMZN,2026-03-31T22:59:22Z,2026-03-31,Thesportingtribune.com,Eric Lambkins II,Amazon Prime's Jerry West documentary exposes the darkness and complexity behind the man that the NBA's standard of excellence,"He found and constructed talent. He won 9 rings. But Jerry West sat across from me eating vanilla ice cream, admitting that he was ""a nervous wreck before every game."" Inside the new documentary that reveals the price of perfection—and why the man who became …","NEW YORKThe bowels of an arena carry many secrets.
Not the secrets of the games played between painted linesthose belong to the crowd, the lights, the immediate explosion of competitionbut the quiet",True,https://www.thesportingtribune.com/2026/03/31/a-complex-logo,0.34,positive,204.8500061035156,210.27999877929688,204.13999938964844,208.2700042724609,58470100,0.0364270088847233,205.5619995117188,210.07142857142856,224.54444449288505,218.32908739362443,0.020916519864313
86,AMZN,2026-03-31T23:00:00Z,2026-03-31,Writersdigest.com,Mark Lawrence,Writing Description in Fiction,"Author Mark Lawrence shares two major keys to writing description in fiction that psychologically hooks readers and builds characters.
The post Writing Description in Fiction appeared first on Writer's Digest.","To describe something is not to photograph it. In delivering description your task is not to supply the reader with sufficient detail to recreate some actual object, place, or (more ephemerally) expe",True,https://www.writersdigest.com/writing-description-in-fiction#article,0.0,neutral,204.8500061035156,210.27999877929688,204.13999938964844,208.2700042724609,58470100,0.0364270088847233,205.5619995117188,210.07142857142856,224.54444449288505,218.32908739362443,0.020916519864313
87,AMZN,2026-03-31T23:00:00Z,2026-03-31,Amazon.com,aws@amazon.com,Amazon CloudWatch now supports ingesting Security Hub CSPM findings with organization-wide enablement,"Amazon CloudWatch now supports ingesting AWS Security Hub CSPM findings, enabling customers to centrally analyze and monitor security findings directly in CloudWatch Logs. Security Hub CSPM findings are supported in AWS Security Finding Format (ASFF) and Open…","Amazon CloudWatch now supports ingesting AWS Security Hub CSPM findings, enabling customers to centrally analyze and monitor security findings directly in CloudWatch Logs. Security Hub CSPM findings",True,https://aws.amazon.com/about-aws/whats-new/2026/03/amazon-cloudwatch-securityhub-findings/,0.8555,positive,204.8500061035156,210.27999877929688,204.13999938964844,208.2700042724609,58470100,0.0364270088847233,205.5619995117188,210.07142857142856,224.54444449288505,218.32908739362443,0.020916519864313
88,AMZN,2026-03-31T23:16:02Z,2026-03-31,Slickdeals.net,phoinix | Staff,$20.99 | 5-Qt Valvoline High Mileage 150K with Maxlife Plus Technology Motor Oil (5W-20) at Amazon (2 replies),"Amazon [amazon.com] has 5-Qt Valvoline High Mileage 150K with Maxlife Plus Technology Motor Oil (5W-20) for $20.99.
Shipping is free with Prime or on $35+ orders.
5-Quart 10W-30 [amazon.com] - $20.99",Amazon[amazon.com] has 5-Qt Valvoline High Mileage 150K with Maxlife Plus Technology Motor Oil (5W-20) for $20.99.Shipping is free with Prime or on $35+ orders.Price$10 lower (32% savings) than the t,True,https://slickdeals.net/f/19370268-20-99-5-qt-valvoline-high-mileage-150k-with-maxlife-plus-technology-motor-oil-5w-20-at-amazon,0.2732,positive,204.8500061035156,210.27999877929688,204.13999938964844,208.2700042724609,58470100,0.0364270088847233,205.5619995117188,210.07142857142856,224.54444449288505,218.32908739362443,0.020916519864313
