article_id,ticker,published_at,date,source_name,author,title,description,content,content_truncated,url,sentiment_score,sentiment_label,Open,High,Low,Close,Volume,Return_1D,MA_5,MA_21,MA_126,MA_252,Volatility_21
89,AMZN,2026-03-31T23:21:00Z,2026-03-31,GlobeNewswire,Wayne Elsey Enterprises,"Visionary Social Entrepreneur Wayne Elsey Releases New Book, ""The Reuse Economy: Breaking Free From Throwaway Culture""",A compelling new guide to transforming discarded goods into economic lifelines and building a sustainable future. A compelling new guide to transforming discarded goods into economic lifelines and building a sustainable future.,"Orlando, FL, March 31, 2026 (GLOBE NEWSWIRE) -- Wayne Elsey, renowned social entrepreneur, founder of Elsey Enterprises, and the visionary behind innovative fundraising platforms like TreeRaise, Snea",True,https://www.globenewswire.com/news-release/2026/03/31/3266223/0/en/Visionary-Social-Entrepreneur-Wayne-Elsey-Releases-New-Book-The-Reuse-Economy-Breaking-Free-From-Throwaway-Culture.html,0.8316,positive,204.8500061035156,210.27999877929688,204.13999938964844,208.2700042724609,58470100,0.0364270088847233,205.5619995117188,210.07142857142856,224.54444449288505,218.32908739362443,0.020916519864313
90,AMZN,2026-03-31T23:22:07Z,2026-03-31,Dealnews.com,Unknown,Skil 12V/20V Compact Tower Light (Tool Only) for $64 + free shipping,"Amazon offers the Skil 12V/20V Compact Tower Light for $63.99. That's the lowest price we found by $13. Shipping is free. Buy Now at Amazon
 Features
 <ul> <li>270-degree pivot & swivel</li> <li>Powered by Skil 12V or 20V Batteries</li> <li>Collapses for st…",moreGet deals on a selection of Olight flashlights and lighting options as part of Amazon's Big Spring Sale. We've pictured the Olight iMini 2 EDC Rechargeable Keychain Flashlight for $13.28 (best pr,True,https://www.dealnews.com/products/Skil/Skil-12-V-20-V-Compact-Tower-Light-Tool-Only/498130.html,0.6369,positive,204.8500061035156,210.27999877929688,204.13999938964844,208.2700042724609,58470100,0.0364270088847233,205.5619995117188,210.07142857142856,224.54444449288505,218.32908739362443,0.020916519864313
91,AMZN,2026-03-31T23:23:44Z,2026-03-31,The Cut,Asia Milia Ware,What It’s Like Being a Black Beauty Founder Today,"Lisa Price of Carol’s Daughter, Melissa Butler of the Lip Bar, Jackie and Denis Asamoah of Forvr Mood, and more Black beauty founders open up about their journey in business, from the money to barriers that could block Black founders from scaling.","For some, beauty is a place for play, but for Black women, that experience isnt always that simple. Unless they were standing at a counter forFashion Fair, the OG Black beauty brand that centered bro",True,http://www.thecut.com/article/what-its-like-being-a-black-beauty-founder-today.html,0.9052,positive,204.8500061035156,210.27999877929688,204.13999938964844,208.2700042724609,58470100,0.0364270088847233,205.5619995117188,210.07142857142856,224.54444449288505,218.32908739362443,0.020916519864313
92,AMZN,2026-03-31T23:26:07Z,2026-03-31,Bleeding Cool News,Ray Flook,"The Boys Season 5 ""One Week"" Mini-Teaser Includes New Footage","Showrunner Eric Kripke's The Boys isn't messing around today. With about a week to go until the fifth and final season kicks off its run, we've got a new teaser reminding everyone of how many days remain until the beginning of the end hits Prime Video screens…","Posted in: Amazon Studios, TV | Tagged: the boys
Check out the ""One Week"" mini-teaser (with new footage) for the fifth and final season of Prime Video and Showrunner Eric Kripke's The Boys.
Showrun",True,https://bleedingcool.com/tv/the-boys-season-5-one-week-mini-teaser-includes-new-footage/,0.1779,positive,204.8500061035156,210.27999877929688,204.13999938964844,208.2700042724609,58470100,0.0364270088847233,205.5619995117188,210.07142857142856,224.54444449288505,218.32908739362443,0.020916519864313
93,AMZN,2026-03-31T23:30:31Z,2026-03-31,Web-price.info,Ryo,"【期間限定セール+10%OFF！】Ugreen CM85045368 － Thunderbolt 3/4 PCIe 4.0x4対応 NVMe M.2 SSD外付けケース ケーブル2本セットが9,719円送料無料 - 安値世界一への挑戦",Ugreen CM85045368 Thunderbolt 3/4 PC...,"Ugreen CM85045368 Thunderbolt 3/4 PCIe 4.0x4対応 NVMe M.2 SSD外付けケース ケーブル2本セットが Amazon にてお買い得価格で販売されています。

今ならさらに、割引クーポンコード「DEAL10OFF」を適用することで10%OFFとお買い得。10,799円 → 9,719円となります。

セール期間は4/6まで。マーケットプレイス 取扱",True,https://web-price.info/blog/10offugreen-cm85045368-thunderbolt-34-pcie-40x4-nvme-m2-ssd-29719.php,0.1779,positive,204.8500061035156,210.27999877929688,204.13999938964844,208.2700042724609,58470100,0.0364270088847233,205.5619995117188,210.07142857142856,224.54444449288505,218.32908739362443,0.020916519864313
94,AMZN,2026-03-31T23:37:56Z,2026-03-31,Just Jared,Just Jared,Brandy Says Ex-Boyfriend Boyz II Men Singer Wanya Morris 'Took Advantage' of Her in Age-Gap Relationship,"Brandy is opening up about her previous relationship with ex-boyfriend Wanya Morris. The 47-year-old singer writes about their relationship in her new memoir Phases, detailing how she believes the Boyz II Men singer “took advantage” of her in an excerpt from …","Brandy is opening up about her previous relationship with ex-boyfriend Wanya Morris.
The 47-year-old singer writes about their relationship in her new memoir Phases, detailing how she believes the B",True,https://www.justjared.com/2026/03/31/brandy-says-ex-boyfriend-boyz-ii-men-singer-wanya-morris-took-advantage-of-her-in-age-gap-relationship/,0.0,neutral,204.8500061035156,210.27999877929688,204.13999938964844,208.2700042724609,58470100,0.0364270088847233,205.5619995117188,210.07142857142856,224.54444449288505,218.32908739362443,0.020916519864313
95,AMZN,2026-03-31T23:39:49Z,2026-03-31,Slickdeals.net,phoinix,Refurb: Apple Magic Wireless Mouse 2 $30 + Free S&H w/ Prime,Woot! has Refurbished: Apple Magic Wireless Mouse 2 (3 Colors) for $34.99 - $5 when you apply coupon code APPLEFIVE at checkout = $29.99. Shipping is free for Amazon Prime Members (must login with you,"This collaborative space allows users to contribute additional information, tips, and insights to enhance the original deal post. Feel free to share your knowledge and help fellow shoppers make infor",True,https://slickdeals.net/f/19367088-refurb-apple-magic-wireless-mouse-2-30-free-s-h-w-prime,0.8591,positive,204.8500061035156,210.27999877929688,204.13999938964844,208.2700042724609,58470100,0.0364270088847233,205.5619995117188,210.07142857142856,224.54444449288505,218.32908739362443,0.020916519864313
96,AMZN,2026-03-31T23:40:24Z,2026-03-31,Dealnews.com,Unknown,EverPlus Home Security Reinforcement Door Lock for $9 + free shipping w/ Prime,"As part of its Big Spring Sale, Amazon discounts this reinforcement lock from EverPlus by 45%. You'd pay $3 more elsewhere. Shipping is free for Prime members. Buy Now at Amazon",moreThe Oatey Fix-It Repair Ring is $2 under what most other major retailers charge. It includes four slotted mounting tabs and 10 mounting holes for a universal fit. Shipping is free for MyLowe's me,True,https://www.dealnews.com/products/Ever-Plus-Home-Security-Reinforcement-Door-Lock/498131.html,0.7003,positive,204.8500061035156,210.27999877929688,204.13999938964844,208.2700042724609,58470100,0.0364270088847233,205.5619995117188,210.07142857142856,224.54444449288505,218.32908739362443,0.020916519864313
97,AMZN,2026-03-31T23:45:23Z,2026-03-31,Web-price.info,Ryo,"【期間限定セール+10%OFF！】UGREEN Maxidok 10-in-1 Thunderbolt 5 ドッキングステーションが25,131円送料無料 - 安値世界一への挑戦",Thunderbolt5&times;2+DP 3画面出力 8K@60H...,Thunderbolt5×2+DP 3画面出力 8K@60Hz DC140W PD110W 急速充電 120Gbps 高速転送 1Gbps イーサネット・SD3.0 カードリーダー・USB-A3.2×3 サンダーボルト5/4/USB4 対応 UGREEN Maxidok 10-in-1 Thunderbolt 5 ドッキングステーション が Amazon にてお買い得価格で販売されています。,True,https://web-price.info/blog/10offugreen-maxidok-10-in-1-thunderbolt-5-25131.php,0.1779,positive,204.8500061035156,210.27999877929688,204.13999938964844,208.2700042724609,58470100,0.0364270088847233,205.5619995117188,210.07142857142856,224.54444449288505,218.32908739362443,0.020916519864313
98,AMZN,2026-03-31T23:49:01Z,2026-03-31,BusinessLine,Reuters,US stocks rally sharply as Trump signals potential end to Iran conflict,"Major U.S. indexes posted their biggest gains in months, led by big tech stocks, even as geopolitical tensions and economic uncertainty continue to weigh on markets.","Wall Street ended sharply higher on Tuesday, lifted by speculation about a potential de-escalation in the Middle East conflict that has sent oil prices soaring and fueled fears of global inflation in",True,https://www.thehindubusinessline.com/markets/us-stocks-rally-sharply-as-trump-signals-potential-end-to-iran-conflict/article70809550.ece,-0.6249,negative,204.8500061035156,210.27999877929688,204.13999938964844,208.2700042724609,58470100,0.0364270088847233,205.5619995117188,210.07142857142856,224.54444449288505,218.32908739362443,0.020916519864313
99,AMZN,2026-03-31T23:52:33Z,2026-03-31,SiliconANGLE News,Mike Wheatley,OpenAI just closed on a record-breaking $122B funding round that brings its value to $852B,"OpenAI Group PBC showed that it’s still the darling of artificial intelligence investors today, announcing it has raised $122 billion at an $852 billion valuation, the largest funding round in Silicon Valley’s history. The round, which comes at a time when th…","OpenAI Group PBC showed that its still the darling of artificial intelligence investors today, announcing it has raised $122 billion at an $852 billion valuation, the largest funding round in Silicon",True,https://siliconangle.com/2026/03/31/openai-just-closed-record-breaking-122b-funding-round-brings-value-852b/,0.7845,positive,204.8500061035156,210.27999877929688,204.13999938964844,208.2700042724609,58470100,0.0364270088847233,205.5619995117188,210.07142857142856,224.54444449288505,218.32908739362443,0.020916519864313
