ticker,published_at,source_name,author,title,description,content,url
NVDA,2026-03-31T19:12:21Z,Slashdot.org,feedfeeder,Iran threatens imminent attacks on US tech companies in the Middle East,"The Islamic Revolutionary Guard Corps (IRGC), a branch of Iran's armed forces, has threatened to target US tech companies' operations in the Middle East. It told employees of 18 companies — including Apple, Google, Meta and NVIDIA — “to leave their workplaces…","The Islamic Revolutionary Guard Corps (IRGC), a branch of Iran's armed forces, has threatened to target US tech companies' operations in the Middle East. It told employees of 18 companies — including… [+1493 chars]",https://slashdot.org/firehose.pl?op=view&amp;id=181193926
NVDA,2026-03-31T19:08:05Z,Decrypt,Stacy Elliott,"Bitcoin, Crypto Stocks Climb on Reports That Iran's President Is 'Ready to End War'",Stocks are surging while Bitcoin and Ethereum hit their highest prices in days after Iran's president said he's looking to end the conflict.,"Crypto stocks and Bitcoin saw sudden gains Tuesday on multiple reports that Iranian President Masoud Pezeshkian is ""ready to end war.""
Crypto exchange Coinbase has gained nearly 9% since the opening… [+3232 chars]",https://decrypt.co/362913/bitcon-crypto-stocks-climb-reports-iranian-president-end-war
NVDA,2026-03-31T18:56:45Z,MacStories,Devon Dundee,NVIDIA GeForce NOW Adds 4K 90 FPS Game Streaming on Apple Vision Pro,"Source: NVIDIA. NVIDIA has released version 2.0.83 of its GeForce NOW game streaming service with a couple of upgrades for Vision Pro users. First, games can now be streamed at up to 4K resolution at 90 FPS. Gaming at this quality requires a subscription to t…","NVIDIA has released version 2.0.83 of its GeForce NOW game streaming service with a couple of upgrades for Vision Pro users. First, games can now be streamed at up to 4K resolution at 90 FPS. Gaming … [+1654 chars]",https://www.macstories.net/news/nvidia-geforce-now-adds-4k-90-fps-game-streaming-on-apple-vision-pro/
NVDA,2026-03-31T18:45:04Z,pymnts.com,PYMNTS,Lilly and Novo Show How AI Is Rewiring Big Pharma,"Eli Lilly and Novo Nordisk, the two companies that dominate the global market for GLP-1 weight loss and diabetes drugs, are each deploying artificial intelligence (AI) across different stages of drug development in ways that are beginning to reshape how fast …","Eli Lilly and Novo Nordisk, the two companies that dominate the global market for GLP-1 weight loss and diabetes drugs, are each deploying artificial intelligence (AI) across different stages of drug… [+4128 chars]",https://www.pymnts.com/artificial-intelligence-2/2026/lilly-and-novo-show-how-ai-is-rewiring-big-pharma/
NVDA,2026-03-31T18:45:00Z,CNA,,Iran Guards say will target US tech firms if more leaders killed,<![CDATA[ Iran’s Revolutionary Guards warned US tech firms they would face “reciprocal action” over alleged roles in targeted assassinations of Iranian leaders. ]]>,"TEHRAN: Iran's Revolutionary Guards said on Tuesday (Mar 31) that they would target leading US technology firms like Apple, Google and Meta if more Iranian leaders were killed in ""targeted assassinat… [+1265 chars]",https://www.channelnewsasia.com/world/meta-google-apple-iran-us-israel-war-strikes-tech-6029231
NVDA,2026-03-31T18:37:35Z,Techpowerup.com,AleksandarK,NVIDIA Launches Auto Shader Compilation for Faster Game Loading and Less Stuttering,"The NVIDIA App update today introduced some interesting features, such as DLSS 4.5 dynamic multi-frame generation and a 6x mode. Additionally, the app now includes a new beta version of NVIDIA Auto Shader Compilation (ASC). This feature takes DirectX 12 shade…","The NVIDIA App update today introduced some interesting features, such as DLSS 4.5 dynamic multi-frame generation and a 6x mode. Additionally, the app now includes a new beta version of NVIDIA Auto S… [+2652 chars]",https://www.techpowerup.com/347912/nvidia-launches-auto-shader-compilation-for-faster-game-loading-and-less-stuttering
NVDA,2026-03-31T18:31:02Z,Yahoo Entertainment,,Why Nvidia And Tesla Are Suddenly Knocking On Samsung's Door,,"If you click 'Accept all', we and our partners, including 251 who are part of the IAB Transparency &amp; Consent Framework, will also store and / or access information on a device (in other words, us… [+1046 chars]",https://consent.yahoo.com/v2/collectConsent?sessionId=1_cc-session_f904d31f-7bdc-42fd-9e99-cd6a3e743ed0
NVDA,2026-03-31T18:24:48Z,Forbes,"Brandon Kochkodin, Forbes Staff, 
 Brandon Kochkodin, Forbes Staff
 https://www.forbes.com/sites/brandonkochkodin/",Billionaire Jack Dorsey Thinks AI Will Kill Middle Management,"Billionaire Jack Dorsey says AI could replace middle managers. After cutting 4,000 jobs at Block, he may already be putting that idea to work.","When he is not talking about replacing middle managers with AI, billionaire Jack Dorsey is often talking up Bitcoin. (Photo by Marco BELLO / AFP) (Photo by MARCO BELLO/AFP via Getty Images)
AFP via … [+3698 chars]",https://www.forbes.com/sites/brandonkochkodin/2026/03/31/billionaire-jack-dorsey-thinks-ai-will-kill-middle-management/
NVDA,2026-03-31T18:22:49Z,Tom's Hardware UK,Jeffrey Kampman,"We go hands-on with Nvidia's DLSS 4.5 Dynamic Multi Frame Generation and its 5X and 6X multipliers — more generated frames, now tailor-made for your monitor's refresh rate",The arrival of Nvidia's DLSS 4.5 Dynamic Multi Frame Generation mode and its extended 5X and 6X multipliers promises more control and higher generated frame rates for GeForce RTX 50-series graphics cards. We went hands-on to see just how far AI can stretch on…,"For GeForce gaming, 2026 has so far been the year of software updates to existing GPUs as the world's cutting-edge silicon gets swallowed up by AI demand. DLSS 4.5 upscaling was the first of those up… [+11438 chars]",https://www.tomshardware.com/pc-components/gpus/we-go-hands-on-with-nvidias-dlss-4-5-dynamic-multi-frame-generation-and-its-5x-and-6x-multipliers-more-generated-frames-now-tailor-made-for-your-monitors-refresh-rate
NVDA,2026-03-31T18:20:51Z,Fortune,Jeremy Kahn,AI’s ability to see ‘mirages’ shows how alien machine brains really are,"AI models can analyze images that don't exist, new research shows, raising big questions about how they work and well they will perform in real world settings","Hello and welcome to Eye on AI. In this editionAnthropic suffers multiple sensitive data leaksOpenAI ditches Sora, and loses its deal with DisneyMistral raises money for AI data center driveAI could … [+18224 chars]",https://fortune.com/2026/03/31/ai-mirages-alien-machine-brains-anthropic-leaks/
NVDA,2026-03-31T18:15:43Z,The Times of India,Shreya Biswas,Nvidia stock price today surges: Why NVDA jumps after $2 billion Marvell deal sparking massive AI growth buzz,Nvidia Stock Price: Nvidia shares saw a significant jump after announcing a substantial $2 billion investment in Marvell Technology. This strategic move strengthens Nvidia's AI ecosystem through an expanded partnership focused on AI infrastructure. The collab…,"(Catch all the US News, UK News, Canada News, International Breaking News Events, and Latest News Updates on The Economic Times.)
Download The Economic Times News App to get Daily International News… [+8 chars]",https://economictimes.indiatimes.com/news/international/us/nvidia-stock-price-today-surges-why-nvda-jumps-after-2-billion-marvell-deal-sparking-massive-ai-growth-buzz/articleshow/129934396.cms
NVDA,2026-03-31T18:15:08Z,Nvidia.com,Max Bickley,Stream High-Fidelity Spatial Computing Content to Any Device with NVIDIA CloudXR 6.0,"Spatial computing is moving from visualization to active collaboration, adding increasingly more GPU demands on XR hardware to render photorealistic,...","Spatial computing is moving from visualization to active collaboration, adding increasingly more GPU demands on XR hardware to render photorealistic, physics-accurate, high-fidelity spatial content i… [+9627 chars]",https://developer.nvidia.com/blog/stream-high-fidelity-spatial-computing-content-to-any-device-with-nvidia-cloudxr-6-0/
NVDA,2026-03-31T18:08:33Z,Futurism,Frank Landymore,Remember That Robot Olaf Disney Was So Proud of? It Just Wiped Out So Hard That His Carrot Nose Went Clattering Across the Pavement,"It's ""Frozen"" alright.
The post Remember That Robot Olaf Disney Was So Proud of? It Just Wiped Out So Hard That His Carrot Nose Went Clattering Across the Pavement appeared first on Futurism.","Can’t-miss innovations from the bleeding edge of science and tech
Disney’s much-hyped Olaf robot just got a faceful of pavement.
In a viral video, the animatronic of the beloved character from the … [+2849 chars]",http://futurism.com/robots-and-machines/disney-olaf-robot-wipe-out
NVDA,2026-03-31T18:08:19Z,Pypi.org,open-source-team@scitrera.com,sparkrun 0.2.12,Launch and manage Docker-based inference workloads on NVIDIA DGX Spark systems,"A required part of this site couldnt load. This may be due to a browser
 extension, network issues, or browser settings. Please check your
 connection, disable any ad blockers, or try using a diffe… [+12 chars]",https://pypi.org/project/sparkrun/0.2.12/
NVDA,2026-03-31T17:59:01Z,The Times of India,Piyush Shukla,"Why is the US stock market up today? Dow Jones soars 900 points, Nasdaq spikes 3% in powerful rebound as S&P 500 turns green - Here's Top Gainers Today in US Stock Market","Why is the US stock market up today? Dow surges 900+ points as S&P 500 and Nasdaq explode in massive rally. This US stock market rally today comes as easing Iran tensions, falling oil prices, and lower bond yields boost confidence. Investors are rushing back …","Why is the US stock market up today? Dow surges 900+ points as S&amp;P 500 and Nasdaq explode in massive rally.: US stock market is up today, and the numbers are hard to ignore. The Dow Jones Industr… [+8487 chars]",https://economictimes.indiatimes.com/news/international/us/why-is-the-us-stock-market-up-today-dow-jones-soars-900-points-nasdaq-spikes-3-in-powerful-rebound-as-sp-500-turns-green-heres-top-gainers-today-in-us-stock-market/articleshow/129933853.cms
NVDA,2026-03-31T17:53:32Z,Pypi.org,cuda_installer@nvidia.com,nvidia-libmathdx-cu13 0.3.2.6,NVIDIA MathDx runtime code-generation library,"A required part of this site couldnt load. This may be due to a browser
 extension, network issues, or browser settings. Please check your
 connection, disable any ad blockers, or try using a diffe… [+12 chars]",https://pypi.org/project/nvidia-libmathdx-cu13/0.3.2.6/
NVDA,2026-03-31T17:52:59Z,The Daily Caller,Jack Cowhick,Iran Threatens To Blow Up American Tech Firms,"Iran’s Islamic Revolutionary Guard Corps (IRGC) threatened to target American tech companies on Tuesday, claiming they are involved in strikes against Iran. In a statement published by Tasnim News Agency, one of the Islamic Republic’s state media agencies, th…","Iran’s Islamic Revolutionary Guard Corps (IRGC) threatened to target American tech companies on Tuesday, claiming they are involved in strikes against Iran.
In a statement published by Tasnim News A… [+1969 chars]",https://dailycaller.com/2026/03/31/iran-blow-up-american-tech-firms/
NVDA,2026-03-31T17:51:17Z,The Times of India,Shivaji Dasgupta,Apple hasn't fallen far from iTree,"Celebrating 50 years of trailblazing advancements, Apple has transformed the tech landscape and fueled artistic imagination. Its iconic marketing strategies have created a formidable brand identity. As they unveil fresh products and harness the power of AI, I…","Apple, which turns 50 today, is much more than magical technology or a charismatic brand. It's the 'forever' beginning of change in the way we live and work.A sassy biopic can easily be stitched from… [+3922 chars]",https://economictimes.indiatimes.com/opinion/et-commentary/apple-hasnt-fallen-far-from-itree/articleshow/129933803.cms
NVDA,2026-03-31T17:37:36Z,Yahoo Entertainment,,Is NVIDIA Corporation (NVDA) one of the Best Goldman Sachs AI Stocks: Top 12 Stocks to Buy?,,"If you click 'Accept all', we and our partners, including 251 who are part of the IAB Transparency &amp; Consent Framework, will also store and / or access information on a device (in other words, us… [+1046 chars]",https://consent.yahoo.com/v2/collectConsent?sessionId=1_cc-session_d24872d7-48b9-4fe4-8bc0-9979dcd1d37f
NVDA,2026-03-31T17:37:01Z,Android Authority,Taylor Kerns,This VPN provider is launching a privacy-first alternative to other AI platforms,VPN service ExpressVPN now offers an AI subscription that it says is more private than comparable services.,"<ul><li>ExpressVPN now offers an AI client, ExpressAI.</li><li>ExpressAI is meant to keep your data private: information entered or uploaded isnt reviewed by humans or used to train models.</li><li>T… [+1789 chars]",https://www.androidauthority.com/expressvpn-expressai-3653606/
NVDA,2026-03-31T17:32:18Z,Electrek,Fred Lambert,Tesla named on Iran’s 18-company target list threatening Gulf operations,Iran’s Islamic Revolutionary Guard Corps (IRGC) has named Tesla among 18 US companies whose Middle East operations it is threatening to attack in retaliation for the killings of Iranian military leaders. The threat carries an explicit deadline: 8:00 PM Tehran…,Iran’s Islamic Revolutionary Guard Corps (IRGC) has named Tesla among 18 US companies whose Middle East operations it is threatening to attack in retaliation for the killings of Iranian military lead… [+4821 chars],http://electrek.co/2026/03/31/tesla-irgc-target-list-gulf-operations-threat/
NVDA,2026-03-31T17:26:58Z,Pypi.org,,openocto added to PyPI,"Any time, any device, anything. AI agent that controls all your terminals across firewalls.","Any time, any device, anything.
Too many devices? Let Octo handle it.
How It Works
Your Agent HTTP Redis Relay HTTP Remote GPU 
 (Claude Code)&gt; (Upstash) &lt; (octo daemon)
 serverless 
 MCP… [+7986 chars]",https://pypi.org/project/openocto/
NVDA,2026-03-31T17:14:32Z,Tom's Hardware UK,Luke James,Nvidia invests $2 billion in Marvell to deepen NVLink Fusion partnership — signs deal with one of its biggest competitors,Nvidia announced today that it has invested $2 billion in Marvell Technology and entered a partnership connecting Marvell to Nvidia's AI factory and AI-RAN ecosystem through NVLink Fusion.,"Nvidia announced today that it has invested $2 billion in Marvell Technology and entered a partnership connecting Marvell to Nvidia's AI factory and AI-RAN ecosystem through NVLink Fusion, the tech t… [+3307 chars]",https://www.tomshardware.com/tech-industry/nvidia-invests-2-billion-in-marvell-to-deepen-nvlink-fusion-partnership
NVDA,2026-03-31T17:10:56Z,ZDNet,Taylor Clemons,"This HP gaming laptop just dropped under $1,000 - a rarity during the RAM-pocalypse","The price of gaming laptops is through the roof, but right now at HP, you can snag the Victus 15 at a big discount.","HP/ZDNET
With the hype around AI and LLMs driving up the cost of RAM and SSDs, the prices of gaming PCs and laptops have skyrocketed, with even basic models doubling in price. This comes hot off the… [+1914 chars]",https://www.zdnet.com/home-and-office/home-entertainment/hp-victus-15-deal-amazon-spring-sale-2026/
NVDA,2026-03-31T17:08:39Z,The Times of India,,AI video generation startup Runway rolls out $10 million VC fund: Report,"The VC fund will back early-stage startups. The New York-based company’s Builders Programme will support startups from seed to Series C stages across AI, media, and world simulation. Participants will receive free API credits.","Artificialintelligence (AI) video generation startup Runway has launched a $10 million venture fund to back early-stage startups, according to a report by TechCrunch on Tuesday.The New York-based com… [+2160 chars]",https://economictimes.indiatimes.com/tech/funding/ai-video-generation-startup-runway-rolls-out-10-million-vc-fund-report/articleshow/129932576.cms
NVDA,2026-03-31T17:05:03Z,TweakTown,Hassam Nasir,"GeForce Now now brings 4K 90 FPS streaming on Apple Vision Pro, making it outperform Meta headsets","GeForce Now 2.0.83 puts Apple Vision Pro ahead of Meta and Pico with 4K 90 FPS, but it still relies on Safari rather than a dedicated app.Continue reading at TweakTown","NVIDIA's GeForce Now update, version 2.0.83, is here, and the two changes that stand out most in this release are for Apple Vision Pro users. First, ultimate members can now stream games at up to 4K … [+1628 chars]",https://www.tweaktown.com/news/110776/geforce-now-now-brings-4k-90-fps-streaming-on-apple-vision-pro-making-it-outperform-meta-headsets/index.html
NVDA,2026-03-31T17:00:49Z,Tom's Hardware UK,"stephen.warwick@futurenet.com (Stephen Warwick) , Stephen Warwick","Iran issues direct strike threat to Nvidia, Microsoft, Apple, Google, 14 other US tech companies — 'These companies should expect destruction of their facilities in response to each act of terror in Iran'","Iran's Islamic Revolutionary Guard Corps has issued a direct strike threat to a slew of U.S. tech companies including GPU giant Nvidia, Microsoft, Apple, Google, Meta, IBM, Cisco, and Tesla.","Iran's Islamic Revolutionary Guard Corps has issued a direct strike threat to a slew of U.S. tech companies, including GPU giant Nvidia, Microsoft, Apple, Google, Meta, IBM, Cisco, and Tesla, just da… [+2516 chars]",https://www.tomshardware.com/tech-industry/iran-issues-direct-strike-threat-to-nvidia-microsoft-apple-google-14-other-us-tech-companies-these-companies-should-expect-destruction-of-their-facilities-in-response-to-each-act-of-terror-in-iran
NVDA,2026-03-31T17:00:00Z,Wired,Aarian Marshall,Tesla Says Its Robotaxis Are Sometimes Driven by Remote Humans,The electric-car maker says it happens rarely and at speeds below 10 mph. But the disclosure—in response to a US senator's questions—occasioned a call for more transparency.,A series of letters sent by autonomous-vehicle (AV) developers to Democratic US senator Ed Markey of Massachusetts sheds the most light yet on the human side of robot vehicle operations. In the docum… [+3512 chars],https://www.wired.com/story/tesla-says-its-robotaxis-are-sometimes-driven-by-humans/
NVDA,2026-03-31T16:59:26Z,Nvidia.com,Yanzi Zhu,Build and Stream Browser-Based XR Experiences with NVIDIA CloudXR.js,"Delivering high-fidelity VR and AR experiences to enterprise users has typically required native application development, custom device management, and complex...","Delivering high-fidelity VR and AR experiences to enterprise users has typically required native application development, custom device management, and complex deployment pipelines. Now, with the new… [+10270 chars]",https://developer.nvidia.com/blog/build-and-stream-browser-based-xr-experiences-with-nvidia-cloudxr-js/
NVDA,2026-03-31T16:33:03Z,TweakTown,Jak Connor,NVIDIA's Dynamic Multi-Frame Generation can be enabled before its official launch,"NVIDIA's upcoming Dynamic Multi-Frame Generation is launching soon, but it appears users can already enable it through workarounds.Continue reading at TweakTown","NVIDIA's upcoming DLSS 4.5 update will introduce a new feature called Dynamic Multi-Frame Generation (DMFG), but what is interesting is that it's already available via over-the-air (OTA) updates in t… [+1429 chars]",https://www.tweaktown.com/news/110788/nvidias-dynamic-multi-frame-generation-can-be-enabled-before-its-official-launch/index.html
NVDA,2026-03-31T16:32:00Z,MarketBeat,"Ryan Hasson, MarketBeat",5 Cloud and AI Infrastructure Stocks Powering the Next Wave of AI,"These five stocks each play a distinct role in powering the next wave of Artificial Intelligence, from pure-play AI cloud providers to mega-cap compounders.","AI cloud infrastructure visualization above data center servers, showing connected networks powering advanced computing systems.
<ul><li>These five stocks, NBIS, DOCN, GOOGL, CRWV, and ALAB, each pl… [+8891 chars]",https://www.marketbeat.com/originals/5-cloud-and-ai-infrastructure-stocks-powering-the-next-wave-of-ai/?utm_source=yahoofinance&amp;utm_medium=yahoofinance
NVDA,2026-03-31T16:29:55Z,Tom's Hardware UK,"editors@tomshardware.com (Aaron Klotz) , Aaron Klotz",Nvidia DLSS 4.5 Dynamic MFG plus 5X and 6X framegen modes enter beta for RTX 50-series users — update offers greater control over generated frame rates and more headroom for high-refresh-rate displays,Nvidia's DLSS 4.5 Dynamic Multi Frame Generation and its extended 5X and 6X multipliers are now available in beta for RTX 50-series owners.,"Nvidia has launched the second half of the DLSS 4.5 feature set today, with the release of DLSS Dynamic Multi Frame Generation, more aggressive 5x and 6x frame-gen multipliers, and a new ""enhanced fr… [+2864 chars]",https://www.tomshardware.com/pc-components/gpus/nvidia-dlss-4-5-dynamic-mfg-plus-5x-and-6x-framegen-modes-enter-beta-for-rtx-50-series-users-update-offers-greater-control-over-generated-frame-rates-and-more-headroom-for-high-refresh-rate-displays
NVDA,2026-03-31T16:27:02Z,Cohere.com,gmays,Cohere Transcribe: Speech Recognition,"Unmatched accuracy and speed. Transcribe converts your business’ audio data into precise text for search, analytics, and automation.","Cohere is announcing Transcribe, a state-of-the-art automatic speech recognition (ASR) model that is open source and available today for download.
Speech is rapidly becoming a core modality for AI-e… [+8127 chars]",https://cohere.com/blog/transcribe
NVDA,2026-03-31T16:25:12Z,PCMag.com,Michael Kan,I Watched Nvidia's Controversial DLSS 5 Turn 'Potato Faces' Into Photorealistic Characters,"Is Nvidia's forthcoming DLSS 5, shown GTC 2026, a game-ethics question mark? Is it spectacular? Yes and yes. Here are my first impressions from a demo Nvidia showed me.
Big leaps in game graphics used to be obvious—the kind you’d notice instantly, no squinty …","Big leaps in game graphics used to be obviousthe kind youd notice instantly, no squinty side-by-side comparisons required. Lately? Not so much. Gains have been real, but incremental, easy to miss unl… [+5986 chars]",https://uk.pcmag.com/graphics-cards/164156/i-watched-nvidias-controversial-dlss-5-turn-potato-faces-into-photorealistic-characters
NVDA,2026-03-31T16:25:12Z,PCMag.com,Michael Kan,I Watched Nvidia's Controversial DLSS 5 Turn 'Potato Faces' Into Photorealistic Characters,"Is Nvidia's forthcoming DLSS 5, shown GTC 2026, a game-ethics question mark? Is it spectacular? Yes and yes. Here are my first impressions from a demo Nvidia showed me.
Big leaps in game graphics used to be obvious—the kind you’d notice instantly, no squinty …","Big leaps in game graphics used to be obviousthe kind youd notice instantly, no squinty side-by-side comparisons required. Lately? Not so much. Gains have been real, but incremental, easy to miss unl… [+5986 chars]",https://me.pcmag.com/en/graphics-cards/36303/i-watched-nvidias-controversial-dlss-5-turn-potato-faces-into-photorealistic-characters
NVDA,2026-03-31T16:22:12Z,Yahoo Entertainment,,This Nvidia Partner's Stock Is Soaring on a New Deal With the AI Chip Leader and $2 Billion Investment,,"If you click 'Accept all', we and our partners, including 251 who are part of the IAB Transparency &amp; Consent Framework, will also store and / or access information on a device (in other words, us… [+1046 chars]",https://consent.yahoo.com/v2/collectConsent?sessionId=1_cc-session_5fd8f5f2-61ae-4029-9504-8b41a93a6b2d
NVDA,2026-03-31T16:18:36Z,Yahoo Entertainment,,Goldman Sachs has a message on Nvidia stock for investors,,"If you click 'Accept all', we and our partners, including 251 who are part of the IAB Transparency &amp; Consent Framework, will also store and / or access information on a device (in other words, us… [+1046 chars]",https://consent.yahoo.com/v2/collectConsent?sessionId=1_cc-session_1f277af7-a323-4453-ad8b-e2f4e8b028a7
NVDA,2026-03-31T16:05:02Z,Yahoo Entertainment,Syeda Seirut Javed,Jim Cramer Says “The Investments That NVIDIA Makes Are Part of Creating an Ecosystem That Wants to Use NVIDIA”,"Jim Cramer gave top insight on NVIDIA Corporation (NYSE:NVDA), sharing a game plan of what to buy, sell, and hold right now. A club member asked how the...","Jim Cramer gave top insight on NVIDIA Corporation (NYSE:NVDA), sharing a game plan of what to buy, sell, and hold right now. A club member asked how the companys multi-billion-dollar investments in o… [+2079 chars]",https://finance.yahoo.com/markets/stocks/articles/jim-cramer-says-investments-nvidia-160502261.html
NVDA,2026-03-31T16:04:51Z,Yahoo Entertainment,Syeda Seirut Javed,Jim Cramer on CoreWeave: “I Want You to Keep It”,"Jim Cramer gave top insight on CoreWeave, Inc. (NYSE:CRWV), sharing a game plan of what to buy, sell, and hold right now. A caller asked whether they should ...","Jim Cramer gave top insight on CoreWeave, Inc. (NYSE:CRWV), sharing a game plan of what to buy, sell, and hold right now. A caller asked whether they should hold on to their CRWV shares or sell them.… [+1508 chars]",https://finance.yahoo.com/markets/stocks/articles/jim-cramer-coreweave-want-keep-160451469.html
NVDA,2026-03-31T16:03:00Z,TheStreet,Thomas Richmond,CoreWeave stock gets bold call from Bank of America amid AI shortage,"CoreWeave (CRWV) stock is getting fresh attention after a bullish call from Bank of America. The firm sees a much bigger opportunity ahead, driven by demand ...","CoreWeave (CRWV) stock is getting fresh attention after a bullish call from Bank of America.
The firm sees a much bigger opportunity ahead, driven by demand for AI infrastructure drastically outpaci… [+6211 chars]",https://www.thestreet.com/investing/stocks/coreweave-stock-gets-a-bold-call-from-bank-of-america-amid-ai-shortage
