ticker,published_at,source_name,author,title,description,content,url
NVDA,2026-03-31T16:00:02Z,Tom's Hardware UK,Luke James,Fujitsu plans dedicated 1.4nm AI chip manufactured entirely in Japan by Rapidus — AI chip to be designed and manufactured domestically,"Fujitsu plans to develop an NPU fabricated on an advanced 1.4nm process by Rapidus, designed for AI inference in servers and related systems.","Fujitsu plans to develop an NPU fabricated on an advanced 1.4nm process by Rapidus, according to a Nikkei Asia report published today. The chip will be designed for AI inference in servers and relate… [+2940 chars]",https://www.tomshardware.com/tech-industry/fujitsu-plans-dedicated-1-4nm-ai-chip-manufactured-entirely-in-japan-by-rapidus
NVDA,2026-03-31T16:00:00Z,Cheezburger.com,"Emmy Pratt, Emmy Pratt",AI-powered Olaf animatronic hilariously passes out at Disney World after malfunctioning in front of guests: 'A generational GIF just dropped.',"Some people are worth melting for
If you've been to a Disney theme park, chances are you've seen your favorite characters walking around meeting guests, and signing autographs. For many years, the only kinds of characters you could meet were either portrayed…","If you've been to a Disney theme park, chances are you've seen your favorite characters walking around meeting guests, and signing autographs. For many years, the only kinds of characters you could m… [+710 chars]",https://cheezburger.com/44884229/ai-powered-olaf-animatronic-hilariously-passes-out-at-disney-world-after-malfunctioning-in-front-of
NVDA,2026-03-31T15:54:29Z,MacRumors,MacRumors Staff,Iran Reportedly Warns Apple is Among Potential Targets,"In a Telegram post today, Iran's Islamic Revolutionary Guard Corps warned that Apple is among a list of major American companies that the country may target amid its ongoing conflict with the United States and Israel, according to CBS News.





The report sa…","In a Telegram post today, Iran's Islamic Revolutionary Guard Corps warned that Apple is among a list of major American companies that the country may target amid its ongoing conflict with the United … [+659 chars]",https://www.macrumors.com/2026/03/31/iran-reportedly-warns-apple-potential-target/
NVDA,2026-03-31T15:54:25Z,Bsky.app,John Gruber,Jensen Huang Doesn’t Smell Anything,"Interviewer: What do you see as America’s unique advantages that other countries don’t have?

Jensen Huang, Nvidia CEO: America's unique advantage that no country could possibly have is President Trump.

[audience applauds]","Nvidia CEO Jensen Huang, during an on-stage interview at The Hill & Valley Forum last week, was asked “What do you see as America’s unique advantages that other countries don’t have?”

His answer, af… [+263 chars]",https://bsky.app/profile/carnage4life.bsky.social/post/3mhnqozt7fs2n
NVDA,2026-03-31T15:47:49Z,GamesRadar+,Tabitha Baker,Bargain hunters will know the MSI Cyborg well but are its sacrifices worth it?,"The MSI Cyborg drops quality of life features present in its sibling devices, while still holding up with workable RTX 5050 performance.","Why you can trust GamesRadar+
Our experts review games, movies and tech over countless hours, so you can choose the best for you. Find out more about our reviews policy.No nonsense 1080p gaming on a… [+12293 chars]",https://www.gamesradar.com/hardware/laptops/msi-cyborg-review/
NVDA,2026-03-31T15:46:06Z,Yahoo Entertainment,,NXP Semiconductors (NXPI) Announces Collaboration with Nvidia on Robotics Solutions,,"If you click 'Accept all', we and our partners, including 251 who are part of the IAB Transparency &amp; Consent Framework, will also store and / or access information on a device (in other words, us… [+1046 chars]",https://consent.yahoo.com/v2/collectConsent?sessionId=1_cc-session_239e52e5-7320-4c9b-98f5-079b46c5023e
NVDA,2026-03-31T15:39:26Z,Business Insider,sobrient@insider.com (Samuel O'Brient),Nvidia just proved again that it's a kingmaker for AI companies,Marvell Technology stock spiked as much as 11% after Nvidia announced a $2 billion investment in the company.,"The move: Marvell Technology stock jumped as much as 11% on Tuesday. Shares are now up 12% in 2026 and have climbed more than 50% over the past year.
The why: Marvell stock's jump on Tuesday is than… [+1654 chars]",https://www.businessinsider.com/marvell-technology-stock-price-chips-surging-ai-investing-mrvl-nvda-2026-3
NVDA,2026-03-31T15:26:50Z,The Times of India,Reuters,US Stocks: Nvidia bets $2 billion on Marvell as rising AI adoption fuels competition; shares rise,Nvidia has ​invested $2 billion in Marvell Technology as part of efforts ​to make it easier for customers to use the custom artificial intelligence chips that the smaller company designs with Nvidia's networking gear and central processors.,Nvidia has invested $2 billion in Marvell Technology as part of efforts to make it easier for customers to use the custom artificial intelligence chips that the smaller company designs with Nvidia's … [+1801 chars],https://economictimes.indiatimes.com/markets/us-stocks/news/us-stocks-nvidia-bets-2-billion-on-marvell-as-rising-ai-adoption-fuels-competition-shares-rise/articleshow/129930476.cms
NVDA,2026-03-31T15:24:12Z,The Times of India,ETtech,"Oracle begins new round of layoffs amid rising AI, data centre spends; Indian employees also impacted",The Larry Ellison-led company is slashing jobs across cloud and database units. The restructuring is aimed at transitioning it from a traditional database software provider into an AI cloud rival to Amazon and Microsoft.,"Larry Ellison-led Oracle has reportedly begun another round of layoffs amid increased capital expenditure on artificial intelligence (AI) and data centres.Per posts on LinkedIn by impacted employees,… [+2043 chars]",https://economictimes.indiatimes.com/tech/technology/oracle-begins-new-round-of-layoffs-amid-rising-ai-data-centre-spends-indian-employees-also-impacted/articleshow/129930464.cms
NVDA,2026-03-31T15:24:12Z,The Times of India,ETtech,"Oracle Layoffs: Company trims workforce amid rising AI, data centre spends; Indian employees also impacted",Oracle jobs cut: The Larry Ellison-led company is slashing jobs across cloud and database units. The restructuring is aimed at transitioning it from a traditional database software provider into an AI cloud rival to Amazon and Microsoft.,"Larry Ellison-led Oracle has reportedly begun another round of layoffs amid increased capital expenditure on artificial intelligence (AI) and data centres.Per posts on LinkedIn by impacted employees,… [+2073 chars]",https://economictimes.indiatimes.com/tech/technology/oracle-layoffs-company-trims-workforce-amid-rising-ai-data-centre-spends-indian-employees-also-impacted/articleshow/129930464.cms
NVDA,2026-03-31T15:21:53Z,Yahoo Entertainment,,Why I’m Staying Cautious on NVIDIA—and the Stocks I Prefer Instead,,"If you click 'Accept all', we and our partners, including 251 who are part of the IAB Transparency &amp; Consent Framework, will also store and / or access information on a device (in other words, us… [+1046 chars]",https://consent.yahoo.com/v2/collectConsent?sessionId=1_cc-session_61cb613f-63c9-4842-97f1-e7ad9894fd07
NVDA,2026-03-31T15:20:00Z,Hot Hardware,Zak Killian,NVIDIA DLSS 4.5 Tested: The Real-World Impact Of Dynamic Multi-Frame Generation,"Way back at CES 2026, NVIDIA promised major updates to DLSS. No, we're not talking about the recently revealed and roundly controversial DLSS 5; rather, we're talking about the final revisions to DLSS 4.5. We already covered the new models for Super Resolutio…","Way back at CES 2026, NVIDIA promised major updates to DLSS. No, we're not talking about the recently revealed and roundly controversial DLSS 5; rather, we're talking about the final revisions to DLS… [+12279 chars]",https://hothardware.com/news/nvidia-dlss-45-dynamic-mfg-tested
NVDA,2026-03-31T15:13:00Z,Yahoo Entertainment,,Nvidia invests $2B in Marvell Technology as part of AI infrastructure partnership,,"If you click 'Accept all', we and our partners, including 251 who are part of the IAB Transparency &amp; Consent Framework, will also store and / or access information on a device (in other words, us… [+1046 chars]",https://consent.yahoo.com/v2/collectConsent?sessionId=1_cc-session_b8462b5b-c4d6-4281-bf7c-169257b4d1f0
NVDA,2026-03-31T15:09:03Z,The Times of India,Piyush Shukla,"Why is US stock market surging big today? Dow Jones, S&P 500, Nasdaq rise despite Iran war and oil price shock - Tesla, Oracle and Nvidia on the move","US stock market surge today as the Dow Jones jumps over 300 points, the S&P 500 climbs above 6,400, and the Nasdaq leads with strong gains. Stocks are rising despite the Iran war and oil price shock. Investors are reacting to signals from Donald Trump about a…","US stock market surge today is making headlines as the Dow Jones jumped 304 points to 45,521.06, the S&amp;P 500 climbed 1.02% to 6,408.42, and the Nasdaq surged 1.43% to 21,092.38. The rally comes a… [+9352 chars]",https://economictimes.indiatimes.com/news/international/us/why-is-us-stock-market-surging-big-today-dow-jones-sp-500-nasdaq-rise-despite-iran-war-and-oil-price-shock-tesla-oracle-and-nvidia-on-the-move/articleshow/129929827.cms
NVDA,2026-03-31T15:03:19Z,TechCrunch,Tim Fernholz,Nomadic raises $8.4 million to wrangle the data pouring off autonomous vehicles | TechCrunch,Nomadic raises $8.4 million to wrangle the data pouring off autonomous vehicles | TechCrunchtechcrunch.com,"To build the autonomous machines of the future, sometimes your model needs a model. 
Companies developing self-driving cars, robots manipulating the physical environment, or autonomous construction … [+4146 chars]",https://techcrunch.com/2026/03/31/nomadic-raises-8-4-million-to-wrangle-the-data-pouring-off-avs/
NVDA,2026-03-31T15:00:54Z,Cisco.com,Surbhi Paul,The multimillion-dollar fabric decision: Why neoclouds need unified networks,"Discover how unified AI fabrics enable neoclouds to run training and inference concurrently, boosting gross margins and securing long-term customer loyalty by eliminating the need for separate network infrastructures.","The fabric decision that defines margins
An enterprise CFO reviews AI spend: training bills are spiking at a hyperscaler where they already have contracts in place, even if their data does not live … [+11443 chars]",https://blogs.cisco.com/?p=488739
NVDA,2026-04-19T00:00:00Z,Hoover.org,"April 19, 2026","Articles On: Nvidia Chip Servers, Chinese Telecom Companies, AI, and Robots","The Chinese Communist Party seeks to control information technology as a means to shape and censor the communications and opinions of its own people, as well as the communications of individuals beyond China's borders.","China AI Firm Discloses $92 Million of Banned Nvidia Chip Servers to Beijingby Andy Lin and Mackenzie Hawkinsvia Bloomberg on April 10, 2026
China AI Firm Discloses $92 Million of Banned Nvidia Chip… [+972 chars]",https://www.hoover.org/research/articles-nvidia-chip-servers-chinese-telecom-companies-ai-and-robots
NVDA,2026-04-18T23:47:43Z,Pypi.org,jdyer@nvidia.com,nemo-retriever 2026.4.18.dev65,A modern RAG ingestion pipeline from Nvidia,"A required part of this site couldnt load. This may be due to a browser
 extension, network issues, or browser settings. Please check your
 connection, disable any ad blockers, or try using a diffe… [+12 chars]",https://pypi.org/project/nemo-retriever/2026.4.18.dev65/
NVDA,2026-04-18T22:46:13Z,Abacusnoir.com,Agam Brahma,Zero-Copy GPU Inference from WebAssembly on Apple Silicon,"A WebAssembly module's linear memory can be shared directly with the Apple Silicon GPU: no copies, no serialization, no intermediate buffers. Here's how the zero-copy chain works, what we measured, and what it enables for stateful AI inference.","tl;dr: on Apple Silicon, a WebAssembly module's linear memory can be shared directly with the GPU: no copies, no serialization, no intermediate buffers. The CPU and GPU read and write the same physic… [+8803 chars]",https://abacusnoir.com/2026/04/18/zero-copy-gpu-inference-from-webassembly-on-apple-silicon/
NVDA,2026-04-18T21:30:20Z,XDA Developers,Abhishek Kumar Mishra,"Every month Windows gets an emergency patch, and I'm running out of reasons to stay",Windows updates continue to break core features and introduce new problems,"Updates are the core of any software. Windows 11 is an operating system that runs on millions of devices, and Microsoft releases monthly updates without fail. These updates are essential because they… [+5612 chars]",https://www.xda-developers.com/monthly-windows-emergency-patches-will-make-switch-linux/
NVDA,2026-04-18T21:17:00Z,TheStreet,Vuk Zdinjak,Bank of America revamps AMD stock price target,"Advanced Micro Devices (AMD) has gained about 42% in the past month, according to Yahoo Finance at the time of writing, Friday afternoon, April 17. Meanwhile...","Advanced Micro Devices (AMD) has gained about 42% in the past month, according to Yahoo Finance at the time of writing, Friday afternoon, April 17. Meanwhile, the SPDR S&amp;P 500 index (SPY) is up s… [+3584 chars]",https://www.thestreet.com/investing/stocks/bank-of-america-revamps-amd-stock-price-target
NVDA,2026-04-18T21:15:24Z,Yahoo Entertainment,,"Jim Cramer on NVIDIA: “When It Comes to GPUs and Service, I Want to Go With Jensen”",,"If you click 'Accept all', we and our partners, including 251 who are part of the IAB Transparency &amp; Consent Framework, will also store and / or access information on a device (in other words, us… [+1046 chars]",https://consent.yahoo.com/v2/collectConsent?sessionId=1_cc-session_c04709cb-8a53-46f4-93f3-682094390207
NVDA,2026-04-18T19:22:39Z,TechCrunch,Anthony Ha,AI chip startup Cerebras files for IPO | TechCrunch,"In recent months, the company announced an agreement with Amazon Web Services to use Cerebras chips in Amazon data centers, as well as a deal with OpenAI reportedly worth more than $10 billion.","Cerebras Systems, a startup building what CEO Andrew Feldman describes as the fastest AI hardware for training and inference, has filed to go public.
The company previously filed for an initial publ… [+975 chars]",https://techcrunch.com/2026/04/18/ai-chip-startup-cerebras-files-for-ipo/
NVDA,2026-04-18T19:17:39Z,Github.com,caliandbust,Show HN: Trained a 12M transformer on an ML framework we built from scratch,"We’re two second-year CS students, and over the last 4 months we built a ML framework in Rust+CUDA with a TypeScript API on top (and a WebGPU fallback)Our goal is to fully understand the ML stack end-to-end.
To force ourselves to use it for something real, we…","A TypeScript ML framework with Rust native backends (CPU, CUDA, WebGPU) providing autograd, tensor operations, and neural network training at GPU speed.
<ul><li>Automatic differentiation -- full bac… [+3747 chars]",https://github.com/mni-ml/framework
NVDA,2026-04-18T18:30:00Z,Hot Hardware,Zak Killian,Intel Poised to Land Major Foundry Deals for Advanced 14A Chip Fab,"Intel's foundry ambitions have shifted from a hopeful turnaround story into a tangible powerhouse narrative. Following the momentum of its 18A node, the company's successor technology, the 1.4nm-class Intel 14A, is rapidly shaping up to be its first true ""fou…","Intel's foundry ambitions have shifted from a hopeful turnaround story into a tangible powerhouse narrative. Following the momentum of its 18A node, the company's successor technology, the 1.4nm-clas… [+4719 chars]",https://hothardware.com/news/intel-poised-major-foundry-deals-14a
NVDA,2026-04-18T18:18:11Z,24/7 Wall St.,Marc Guberti,The Triple-Tax-Free Account High Earners Are Funding Before Their 401(k) and Most People Have No Idea,"A high earner in their 50s maxing out a 401(k) every year is likely leaving the single most tax-efficient account on the table. For anyone who qualifies, the...","A high earner in their 50s maxing out a 401(k) every year is likely leaving the single most tax-efficient account on the table. For anyone who qualifies, the Health Savings Account is the only accoun… [+4918 chars]",https://247wallst.com/personal-finance/2026/04/18/the-triple-tax-free-account-high-earners-are-funding-before-their-401k-and-most-people-have-no-idea/
NVDA,2026-04-18T17:50:03Z,24/7 Wall St.,Gerelyn Terzo,The Three Numbers That Determine If Your Social Security Gets Taxed,"Most retirees know Social Security can be taxed. Fewer know what triggers it. The formula comes down to three specific numbers, and getting them wrong could ...","<ul><li>Adding just 50% of your $2,076 monthly Social Security benefit to your AGI, pension, and non-taxable interest can push your combined income past the $44,000 threshold for married filers. In t… [+5273 chars]",https://247wallst.com/personal-finance/2026/04/18/the-three-numbers-that-determine-if-your-social-security-gets-taxed/
NVDA,2026-04-18T17:47:00Z,TheStreet,Thomas Richmond,JPMorgan has stark message on Qualcomm stock,"JPMorgan is becoming more cautious on QUALCOMM Incorporated (QCOM) ahead of its upcoming earnings report, citing rising pressure in its core handset business...","JPMorgan is becoming more cautious on QUALCOMM Incorporated (QCOM) ahead of its upcoming earnings report, citing rising pressure in its core handset business. At the same time, newer growth areas are… [+5665 chars]",https://www.thestreet.com/investing/stocks/jpmorgan-has-a-stark-message-on-qualcomm-stock
NVDA,2026-04-18T17:31:58Z,Pypi.org,marc.clasca@bsc.es,nsys2prv 0.6.0.dev2604181,Translate a NVIDIA Nsight System trace to a Paraver trace,"A required part of this site couldnt load. This may be due to a browser
 extension, network issues, or browser settings. Please check your
 connection, disable any ad blockers, or try using a diffe… [+12 chars]",https://pypi.org/project/nsys2prv/0.6.0.dev2604181/
NVDA,2026-04-18T17:25:16Z,Gizmodo.com,Mike Pearl,"Trump, When Asked About White House Meeting with Anthropic’s Dario Amodei: ‘Who?’",The White House is in a tricky position with Anthropic right now.,"In Truth Social-ese, one might say Anthropics Claude Mythos Preview model is “the ‘hottest’ AI model out there”with Trump’s patented awkward scare quotes around “hottest.” Anthropic has said Mythos i… [+4228 chars]",https://gizmodo.com/trump-when-asked-about-white-house-meeting-with-anthropics-dario-amodei-who-2000748236
NVDA,2026-04-18T17:19:30Z,The Times of India,Durva More,Nvidia CEO Jensen Huang loses his cool — here’s what sparked it,Nvidia CEO Jensen Huang spoke in a podcast about selling AI chips to China and global tech competition. He explained that China already has strong computing power and stopping chips may not work. He said companies must keep improving and stay ahead. The discu…,The drama started during a podcast where Jensen Huang spoke with Dwarkesh Patel about a hot topic should the U.S. sell AI chips to China. Patel took a devils advocate role and questioned if giving Ch… [+3340 chars],https://economictimes.indiatimes.com/news/international/us/nvidia-ceo-jensen-huang-loses-his-cool-heres-what-sparked-it/articleshow/130358792.cms
NVDA,2026-04-18T17:12:44Z,Ieee.org,Matthew S. Smith,Graphs That Explain the State of AI in 2026,AI investment is skyrocketing while AI’s impact on jobs and public perception remains mixed,"The capabilities of leading AI models continue to accelerate, and the largest AI companies, including OpenAI and Anthropic, are hurtling toward IPOs later this year. Yet resentment toward AI continue… [+12370 chars]",https://spectrum.ieee.org/state-of-ai-index-2026
NVDA,2026-04-18T17:00:14Z,Pypi.org,,neo-jax added to PyPI,Neoclassical transport code for effective ripple and trapped-particle diagnostics in Boozer coordinates,"Install from PyPI:
pipinstallneo-jax
Neoclassical transport code for computing effective helical ripple and related
trapped-particle diagnostics from Boozer-coordinate geometry, with a Python API,… [+16082 chars]",https://pypi.org/project/neo-jax/
NVDA,2026-04-18T16:30:21Z,XDA Developers,Anurag Singh,"Bazzite turned my second PC into a console, and SteamOS never felt this polished on the desktop",Bazzite is the real deal,"Its funny to think how Linux was once considered the worst operating system for gaming, but then SteamOS came along. It deserves a lot of credit for not just making Linux gaming viable, but actually … [+4518 chars]",https://www.xda-developers.com/bazzite-turned-second-pc-console-steamos-never-felt-polished/
NVDA,2026-04-18T16:12:07Z,Slashdot.org,thfeed,Nvidia RTX 3060 comeback in 2026 could alleviate soaring GPU prices and memory shortages — rumored RTX 5050 9GB abruptly shelved amid speculation,"If relaunched at the right price, the RTX 3060 could re-enter the market as a viable option in a segment facing increasing cost pressures.",The Fine Print: The following comments are owned by whoever posted them. We are not responsible for them in any way.,https://slashdot.org/firehose.pl?op=view&amp;id=181749804
NVDA,2026-04-18T15:53:44Z,Tom's Hardware UK,"editors@tomshardware.com (Kunal Khullar) , Kunal Khullar",Nvidia RTX 3060 comeback in 2026 could alleviate soaring GPU prices and memory shortages — rumored RTX 5050 9GB abruptly shelved amid speculation,"If relaunched at the right price, the RTX 3060 could re-enter the market as a viable option in a segment facing increasing cost pressures.","The Nvidia RTX 3060 graphics card is reportedly making a comeback. According to hardware leaker MEGAsizeGPU, the company is planning to bring back its two-generation-old budget GPU, with a potential … [+2531 chars]",https://www.tomshardware.com/pc-components/gpus/nvidia-rtx-3060-comeback-in-2026-could-alleviate-soaring-gpu-prices-and-memory-shortages-rumored-rtx-5050-9gb-abruptly-shelved-amid-speculation
NVDA,2026-04-18T15:41:40Z,Tom's Hardware UK,"editors@tomshardware.com (Hassam Nasir) , Hassam Nasir","Nvidia RTX 5070 Ti gaming laptop is on sale for 19% off — MSI's Vector 16 has a 144 Hz screen, and comes with Pragmata for free","MSI has put its Vector 16 gaming laptop on sale for just $1,529 at Newegg, offering a solid discount for a beastly hardware combo. You get a Core Ultra 7 255HX paired with a 140W RTX 5070 Ti, 16GB of RAM, and a 512GB SSD, all of which are upgradeable. All tha…","Laptops have become a lot more enticing as of late, especially if you've been looking to upgrade in this gloomy cycle of shortages. Even without the AI boom's consequences, laptops offer a great way … [+2085 chars]",https://www.tomshardware.com/laptops/gaming-laptops/nvidia-rtx-5070-ti-gaming-laptop-is-on-sale-for-19-percent-off-msis-vector-16-has-a-144-hz-screen-and-comes-with-pragmata-for-free
NVDA,2026-04-18T15:05:39Z,Amazon.com,Takahiro Mizuno,AWS と NVIDIA によるフィジカル AI の加速: シミュレーションと実世界での学習による本番環境向けアプリケーションの構築,本記事は 2026/04/15 に公開された “Accelerating physical AI  […],"AI 
 AI AI AI 
 AI AI 
Morgan Stanley 2050 $5 AI 30-40% AI AI 
DHL Supply Chain 44% 34% AI Amazon Web Services (AWS) Amazon AI 
 AI 
AWS NVIDIA Isaac AI 
NVIDIA Isaac 
NVIDIA Isaac NVIDIA Isa… [+972 chars]",https://aws.amazon.com/jp/blogs/news/accelerating-physical-ai-with-aws-and-nvidia-building-production-ready-applications-with-simulation-and-real-world-learning/
NVDA,2026-04-18T15:03:03Z,Mulerun.com,,"Respect to the Man Chasing AI Immortality, While Freeloading Off Our Platform","A technical postmortem on how one person with zero coding experience built a self-evolving AI swarm across 11 platforms using 900 accounts, 56 GitHub Actions workflows, and $0 in compute costs.",TL;DR: A technical postmortem by the (entirely fictional) MuleRun Security Team’s (dispatched) AI Agent on a real security incident. We discovered an automated swarm system using GitHub Actions to or… [+18319 chars],https://blog.mulerun.com/p/ai-immortality-postmortem/
NVDA,2026-04-18T14:38:58Z,Pypi.org,,htop-gpu 0.1.8,"Terminal dashboard for NVIDIA GPUs, system CPU/memory, and processes — clickable, with conda/docker/tmux info per process.","A required part of this site couldnt load. This may be due to a browser
 extension, network issues, or browser settings. Please check your
 connection, disable any ad blockers, or try using a diffe… [+12 chars]",https://pypi.org/project/htop-gpu/0.1.8/
NVDA,2026-04-18T14:33:55Z,Github.com,raullen,"Show HN: Rapid-MLX – Run local LLMs on Mac, 2-3x faster than alternatives","The fastest local AI engine for Apple Silicon. 4.2x faster than Ollama, 0.08s cached TTFT, 100% tool calling. 17 tool parsers, prompt cache, reasoning separation, cloud routing. Drop-in OpenAI repl...","Run AI on your Mac. Faster than anything else.
Run local AI models on your Mac no cloud, no API costs. Works with Cursor, Claude Code, and any OpenAI-compatible app.
pip install serve Gemma 4 26B c… [+30925 chars]",https://github.com/raullenchai/Rapid-MLX
NVDA,2026-04-18T14:01:01Z,Business Insider,Alistair Barr,A coder used AI to rank which tech companies offer the best food at work. Check out the winners.,"Lunches.fyi ranks tech companies by cafeteria food using AI. Fun results, bugs, and a reminder that data quality shapes everything.","Employees inside the Voyager building at Nvidia headquarters in Silicon ValleyBloomberg/Getty Images
<ul><li>A version of this story originally appeared in the BI Tech Memo newsletter.</li><li>Sign … [+1459 chars]",https://www.businessinsider.com/tech-companies-offer-best-food-work-ai-coded-ranking-2026-4
