ticker,published_at,source_name,author,title,description,content,url
NVDA,2026-03-31T23:52:33Z,SiliconANGLE News,Mike Wheatley,OpenAI just closed on a record-breaking $122B funding round that brings its value to $852B,"OpenAI Group PBC showed that it’s still the darling of artificial intelligence investors today, announcing it has raised $122 billion at an $852 billion valuation, the largest funding round in Silicon Valley’s history. The round, which comes at a time when th…","OpenAI Group PBC showed that its still the darling of artificial intelligence investors today, announcing it has raised $122 billion at an $852 billion valuation, the largest funding round in Silicon… [+4840 chars]",https://siliconangle.com/2026/03/31/openai-just-closed-record-breaking-122b-funding-round-brings-value-852b/
NVDA,2026-03-31T23:49:01Z,BusinessLine,Reuters,US stocks rally sharply as Trump signals potential end to Iran conflict,"Major U.S. indexes posted their biggest gains in months, led by big tech stocks, even as geopolitical tensions and economic uncertainty continue to weigh on markets.","Wall Street ended sharply higher on Tuesday, lifted by speculation about a potential de-escalation in the Middle East conflict that has sent oil prices soaring and fueled fears of global inflation in… [+3747 chars]",https://www.thehindubusinessline.com/markets/us-stocks-rally-sharply-as-trump-signals-potential-end-to-iran-conflict/article70809550.ece
NVDA,2026-03-31T23:46:51Z,Pypi.org,jdyer@nvidia.com,nemo-retriever 2026.3.31.dev47,A modern RAG ingestion pipeline from Nvidia,"A required part of this site couldnt load. This may be due to a browser
 extension, network issues, or browser settings. Please check your
 connection, disable any ad blockers, or try using a diffe… [+12 chars]",https://pypi.org/project/nemo-retriever/2026.3.31.dev47/
NVDA,2026-03-31T23:07:07Z,MarketBeat,MarketBeat,Duos Technologies Group Q4 Earnings Call Highlights,Duos Technologies Group (NASDAQ:DUOT) executives used the company’s fourth-quarter and full-year 2025 earnings call to outline a strategic shift toward data ...,"Duos Technologies Group logo
<ul><li>Strategic pivot: New CEO Doug Recker said Duos will ""completely divest the rail division"" within ~60 days and is now fully dedicated to the data center market vi… [+9923 chars]",https://www.marketbeat.com/instant-alerts/duos-technologies-group-q4-earnings-call-highlights-2026-03-31/?utm_source=yahoofinance&amp;utm_medium=yahoofinance
NVDA,2026-03-31T22:58:31Z,PC Gamer,Jody Macgregor,Aether & Iron review,Arcanum meets Bioshock Infinite in a speakeasy.,What is it?: A lean steampunk-ish RPG with tactical combat and visual novel storytelling.Expect to pay: $20/£16.80Developer: Seismic Squirrel/Chaos TheoryPublisher: Seismic SquirrelReviewed on: Windo… [+6049 chars],https://www.pcgamer.com/games/rpg/aether-and-iron-review/
NVDA,2026-03-31T22:35:49Z,Yahoo Entertainment,,NVIDIA Corporation (NVDA) Positioned to Benefit as Customers Ramp up AI Hardware Spend,,"If you click 'Accept all', we and our partners, including 251 who are part of the IAB Transparency &amp; Consent Framework, will also store and / or access information on a device (in other words, us… [+1046 chars]",https://consent.yahoo.com/v2/collectConsent?sessionId=1_cc-session_122f9843-9cf0-4e89-950b-b2d89daaa3b7
NVDA,2026-03-31T22:35:29Z,9to5Mac,Marcus Mendes,Apple among US firms Iran labels ‘terrorist companies’ as it threatens attacks,"As reported by CBS News, Iran’s Islamic Revolutionary Guard Corps (IRGC) vowed to start attacking US-based tech and finance companies in the Mideast starting tomorrow. Here are the details.



 more…","As reported by CBS News, Iran’s Islamic Revolutionary Guard Corps (IRGC) vowed to start attacking US-based tech and finance companies in the Mideast starting tomorrow. Here are the details.
Accordin… [+1526 chars]",https://9to5mac.com/2026/03/31/apple-among-us-firms-iran-labels-terrorist-companies-as-it-threatens-attacks/
NVDA,2026-03-31T22:28:57Z,Www.df.cl,Diario Financiero,IA soberana en Chile: la decisión de US$ 2 billones de la que nadie habla,"DARÍO PAYA CARL MEACHAM Western Hemisphere Business Development, Hydra Host Inc. An NVIDIA Cloud Partner","Un país tiene petróleo o no. La geología impuso esa realidad que nos ha marcado por décadas. Hoy pasa algo sin precedentes: por primera vez, un país puede elegir si será productor o simplemente consu… [+3397 chars]",https://www.df.cl/opinion/columnistas/ia-soberana-en-chile-la-decision-de-us-2-billones-de-la-que-nadie-habla
NVDA,2026-03-31T22:28:48Z,pymnts.com,PYMNTS,OpenAI Valued at $852 Billion in Latest Funding Round,"OpenAI raised $122 billion in a funding round that valued it at $852 billion, the company said in a Tuesday (March 31) press release. The company also announced in the release that it is developing a “unified AI superapp” and that its enterprise business will…","OpenAI raised $122 billion in a funding round that valued it at $852 billion, the company said in a Tuesday (March 31) press release.The company also announced in the release that it is developing a … [+2468 chars]",https://www.pymnts.com/artificial-intelligence-2/2026/openai-valued-at-852-billion-in-latest-funding-round/
NVDA,2026-03-31T22:19:49Z,CNBC,Morgan Chittum,Jim Cramer: Three ways the stock market will flip if the U.S.-Iran war ends,Want to know how the market will react when the war's over? CNBC's Jim Cramer says Tuesday's session gives investors a hint.,"Want to know how the market will react when the U.S.-Iran war finally ends? CNBC's Jim Cramer said Tuesday's session gives investors the answer. 
The ""Mad Money"" host said that the market""tipped its… [+3164 chars]",https://www.cnbc.com/2026/03/31/jim-cramer-three-ways-the-stock-market-will-flip-if-the-us-iran-war-ends.html
NVDA,2026-03-31T22:12:26Z,Pypi.org,,fused-turboquant added to PyPI,"Fused Triton encode/decode kernels for TurboQuant KV cache compression, powered by Randomized Hadamard Transform.","fused-turboquant is a high-performance Python library for compressing LLM KV caches to 2-4 bits using the TurboQuant algorithm (Google Research, ICLR 2026). It fuses the entire quantization pipeline … [+21695 chars]",https://pypi.org/project/fused-turboquant/
NVDA,2026-03-31T22:05:46Z,Yahoo Entertainment,,Nvidia Just Invested $2 Billion in This Chip Stock. Here's What Investors Should Know,,"If you click 'Accept all', we and our partners, including 251 who are part of the IAB Transparency &amp; Consent Framework, will also store and / or access information on a device (in other words, us… [+1046 chars]",https://consent.yahoo.com/v2/collectConsent?sessionId=1_cc-session_67402d4b-0ca5-4135-9a2d-78d2500b2c09
NVDA,2026-03-31T22:01:48Z,The Next Web,Allison Steffens Herrera,Iran’s Revolutionary Guards just named 18 US tech firms as military targets. The age of the civilian data centre is over.,"At 8pm Tehran time on Tuesday, a new kind of front line was drawn, not through desert terrain or along a disputed border, but through the server farms, cloud regions, and corporate campuses of America’s largest technology companies. The Islamic Revolutionary …","At 8pm Tehran time on Tuesday, a new kind of front line was drawn, not through desert terrain or along a disputed border, but through the server farms, cloud regions, and corporate campuses of Americ… [+7779 chars]",https://thenextweb.com/news/iran-irgc-18-us-tech-companies-military-targets/
NVDA,2026-03-31T21:58:12Z,Pypi.org,open-source-team@scitrera.com,sparkrun 0.2.13,Launch and manage Docker-based inference workloads on NVIDIA DGX Spark systems,"A required part of this site couldnt load. This may be due to a browser
 extension, network issues, or browser settings. Please check your
 connection, disable any ad blockers, or try using a diffe… [+12 chars]",https://pypi.org/project/sparkrun/0.2.13/
NVDA,2026-03-31T21:35:48Z,Freerepublic.com,CNBC,"Dow surges 1,100 points, S&P 500 posts best day since May as hopes grow for end of Iran war: Live updates","Stocks rose on Tuesday following new reports that gave investors hope that the U.S.-Iran war could soon come to an end. The Dow Jones Industrial Average was up 1,125.37 points, or 2.49%, and closed at 46,341.51. The move came after an unconfirmed report said …","Skip to comments.
Dow surges 1,100 points, S&amp;P 500 posts best day since May as hopes grow for end of Iran war: Live updatesCNBC ^
 | March 31, 2026
 | Sarah Min, Sean Conlon, Lisa Kailai Han
… [+3431 chars]",https://freerepublic.com/focus/f-news/4373077/posts
NVDA,2026-03-31T21:28:26Z,TechCrunch,Rebecca Bellan,"OpenAI, not yet public, raises $3B from retail investors in monster $122B fund raise | TechCrunch","OpenAI's latest funding round, led by Amazon, Nvidia, and SoftBank, values the AI lab at $852 billion as it nears an IPO.","OpenAI has closed a deal to raise $122 billion at an $852 billion valuation, its largest funding round to date as the company is expected to hit the public markets this year.
The round will add to O… [+2471 chars]",https://techcrunch.com/2026/03/31/openai-not-yet-public-raises-3b-from-retail-investors-in-monster-122b-fund-raise/
NVDA,2026-03-31T21:26:43Z,Foreign Policy,Alexandra Sharp,Iran Says It Will Target U.S. Tech Companies in the Middle East,The threat comes as U.S. Defense Secretary Pete Hegseth warned of a decisive next few days in the war.,"Welcome back to World Brief, where were looking at major U.S. and Iranian military operations, concerns that Hungary is too close to Russia, and Israels new capital punishment law for Palestinians in… [+9537 chars]",http://foreignpolicy.com/2026/03/31/iran-threat-us-tech-companies-irgc-hegseth-strait-hormuz-esfahan-oil-prices/
NVDA,2026-03-31T21:25:12Z,Wired,"Dell Cameron, Louise Matsakis",Iran Threatens to Start Attacking Major US Tech Firms on April 1,"Tech giants like Apple, Google, and Microsoft are among those on a target list released by Iran’s Islamic Revolutionary Guard Corps.",Irans Islamic Revolutionary Guard Corps warned Tuesday that it plans to begin attacking more than a dozen American companies across the Middle East on Wednesday in retaliation for the killing of Iran… [+3382 chars],https://www.wired.com/story/iran-threatens-to-start-attacking-major-us-tech-firms-on-april-1/
NVDA,2026-03-31T21:17:03Z,The Next Web,Cristian Dina,"OpenAI closes record $122 billion round at $852 billion valuation, opens door to retail investors for the first time","There is a number that keeps getting larger, and on Tuesday it got larger again. OpenAI announced that it had closed its latest funding round with $122 billion in committed capital, valuing the ChatGPT maker at $852 billion post-money. The figure is up from t…","There is a number that keeps getting larger, and on Tuesday it got larger again. OpenAI announced that it had closed its latest funding round with $122 billion in committed capital, valuing the ChatG… [+4766 chars]",https://thenextweb.com/news/openai-122-billion-round-852-billion-valuation-retail-investors/
NVDA,2026-03-31T21:14:07Z,Slashdot.org,feedfeeder,"Stock Market Today: Dow Gains 1,100 Points Amid Huge Recovery; Micron, Nvidia Score Big Wins (Live Coverage) - Investor's Business Daily","Stock Market Today: Dow Gains 1,100 Points Amid Huge Recovery; Micron, Nvidia Score Big Wins (Live Coverage)Investor's Business Daily Stock market today: Dow soars 1,000 points, S&P 500 and Nasdaq surge in upbeat end to brutal quarterYahoo Finance Heard on th…",The Fine Print: The following comments are owned by whoever posted them. We are not responsible for them in any way.,https://slashdot.org/firehose.pl?op=view&amp;id=181194464
NVDA,2026-03-31T21:13:57Z,Slashdot.org,feedfeeder,Goldman Sachs has a message on Nvidia stock for investors - thestreet.com,Goldman Sachs has a message on Nvidia stock for investorsthestreet.com Nvidia: Something Big Is Coming (NASDAQ:NVDA)Seeking Alpha Nvidia investors just had a surprising first quarterYahoo Finance Nvidia Stock is Cheap—What That SignalsThe Information Nvidia's…,The Fine Print: The following comments are owned by whoever posted them. We are not responsible for them in any way.,https://slashdot.org/firehose.pl?op=view&amp;id=181194462
NVDA,2026-03-31T21:08:30Z,Moby.co,Mitchell Duran,Microsoft Sees Worst Drop Since 2008 Financial Crisis,"Between the US and Iran war, OpenAI's cash bonfire, and fading growth hype, Microsoft is getting squeezed.","Microsoft Sees Worst Drop Since 2008 Financial Crisis - Moby
Microsofts stock is down almost 22% year to date.
Over the last month, MSFT has been down 7%, feeling the pain and anxiety of simultaneo… [+3045 chars]",https://app.moby.co/home/news/news-microsoft-sees-worst-drop-since-2008-financial-crisis?utm_source=yahoo_finance&amp;utm_medium=rss
NVDA,2026-03-31T21:02:07Z,Openai.com,,OpenAI raises $122B to accelerate the next phase of AI,"OpenAI raises $122 billion in new funding to expand frontier AI globally, invest in next-generation compute, and meet growing demand for ChatGPT, Codex, and enterprise AI.","Today, we closed our latest funding round with $122 billion in committed capital at a post money valuation of $852 billion.
OpenAI is becoming the core infrastructure for AI, making it possible for … [+8638 chars]",https://openai.com/index/accelerating-the-next-phase-ai/
NVDA,2026-03-31T21:00:21Z,XDA Developers,Tanveer Singh,3 reasons your monitor upgrade matters a lot more than your next GPU upgrade,The GPU market will be a bit dry for a few years — invest in a better monitor instead,"A new graphics card is often a massive performance upgrade for a gaming PC, especially if it's generations removed from your existing one. If you're considering buying a new GPU right now, you should… [+7265 chars]",https://www.xda-developers.com/your-next-monitor-upgrade-matters-more-than-gpu/
NVDA,2026-03-31T21:00:00Z,OilPrice.com,Haley Zaremba,Microsoft and NVIDIA Are Using AI to Fast-Track Nuclear Power Development,Tech giants Microsoft and NVIDIA are collaborating on an artificial intelligence project designed to accelerate the development of nuclear energy – in order to feed the growing energy needs of AI. The project aims to develop an “ecosystem of AI-powered digita…,"African energy producers are gaining…
The Trump administration is paying…
The Trump administration is offering…
Set us as your preferred Google source
By Haley Zaremba - Mar 31, 2026, 4:00 PM CDT… [+4472 chars]",https://oilprice.com/Energy/Energy-General/Microsoft-and-NVIDIA-Are-Using-AI-to-Fast-Track-Nuclear-Power-Development.html
NVDA,2026-03-31T20:55:35Z,Forbes,Antonio Pequeño Iv,OpenAI Valued At $852 Billion After Latest Funding Round,The record-breaking funding round comes as the AI company reportedly lays the groundwork for going public.,"OpenAI raised $122 billion in its latest funding round, the artificial intelligence giant announced Tuesday, bringing its post-money valuation to $852 billion.
OpenAI announced the funding round Tue… [+978 chars]",https://www.forbes.com/sites/antoniopequenoiv/2026/03/31/openai-valuation-reaches-852-billion-after-massive-funding-round/
NVDA,2026-03-31T20:45:46Z,Yahoo Entertainment,,Nvidia investors just had a surprising first quarter,,"If you click 'Accept all', we and our partners, including 251 who are part of the IAB Transparency &amp; Consent Framework, will also store and / or access information on a device (in other words, us… [+1046 chars]",https://consent.yahoo.com/v2/collectConsent?sessionId=1_cc-session_3140dfb3-1bca-44d8-b990-adb0b50ca039
NVDA,2026-03-31T20:38:53Z,Newser,Rob Quinn,Stocks Just Had Their Best Day Since Last Spring,"US stocks surged to their best day since last spring on Tuesday, and the Dow Jones Industrial Average soared more than 1,100 points as doubt shifted back to hope on Wall Street for a possible end to the war with Iran. The S&P 500 rose 184.80 points, or...",Analysts said optimism entered markets overnight following a report from the Wall Street Journalsaying President Trump told aides he's willing to end the US military campaign against Iran even if the… [+2170 chars],https://www.newser.com/story/386462/stocks-just-had-their-best-day-since-last-spring.html
NVDA,2026-03-31T20:30:00Z,Telecompetitor,Carl Weinschenk,Comcast Business introduces two services for young and growing organizations,"Comcast Business introduces two services for young and growing organizations
Simplicity for entrepreneurs and growing companies are the keys to Comcast Business’ new Total Solutions Advantage and Buy More Save More services, according to the company. The Tota…","Simplicity for entrepreneurs and growing companies are the keys to Comcast Business new Total Solutions Advantage and Buy More Save More services, according to the company.
The Total Solutions Advan… [+2028 chars]",https://www.telecompetitor.com/comcast-business-introduces-two-services-for-young-and-growing-organizations/
NVDA,2026-03-31T20:29:01Z,New York Post,Reuters,"Dow soars over 1,100 points as Trump sparks hope on Wall Street that Iran war is nearing end",All three major indexes posted their best day since May,"Wall Street surged on Tuesday, lifted by speculation about a potential de-escalation in the Middle East conflict that has sent oil prices soaring and fueled fears of global inflation in recent weeks.… [+3011 chars]",https://nypost.com/2026/03/31/business/dow-soars-over-1100-points-as-trump-sparks-hope-on-wall-street-that-iran-war-is-nearing-end/
NVDA,2026-03-31T20:16:22Z,SiliconANGLE News,Maria Deutscher,Nvidia invests $2B in Marvell as part of new interconnect partnership,"Nvidia Corp. today disclosed that it has invested $2 billion in Marvell Technology Inc., a publicly traded semiconductor designer. The cash infusion is part of a new partnership that will span several parts of the chip market. Santa Clara, California-based Ma…","Nvidia Corp. today disclosed that it has invested $2 billion in Marvell Technology Inc., a publicly traded semiconductor designer.
The cash infusion is part of a new partnership that will span sever… [+4447 chars]",https://siliconangle.com/2026/03/31/nvidia-invests-2b-marvell-part-new-interconnect-partnership/
NVDA,2026-03-31T20:13:45Z,Barchart.com,Wajeeh Khan,Should You Chase the Nvidia-Triggered Rally in Marvell Stock Today?,Marvell stock rallied as Nvidia announced a $2 billion investment in the custom chips specialist. Here’s why long-term investors are recommended to load up...,"Marvell (MRVL) shares pushed meaningfully higher on March 31 after Nvidia (NVDA) announced a massive $2 billion strategic investment in the custom chips specialist.
This landmark deal will accelerat… [+1983 chars]",https://www.barchart.com/story/news/1073940/should-you-chase-the-nvidia-triggered-rally-in-marvell-stock-today
NVDA,2026-03-31T20:05:23Z,Gizmodo.com,Raymond Wong,The Best Gadgets of March 2026,"It was a very packed month for new Apple products, but we also got some notable new gadgets from Sonos, Nintendo, Asus ROG, and even Ikea.","March madness is over. No, not college basketball. I’m, of course, talking about Apple’s own March bonanza headlined by the $600 MacBook Neo. The low-cost and colorful laptop easily stole the spotlig… [+9044 chars]",https://gizmodo.com/best-gadgets-march-2026-2000740331
NVDA,2026-03-31T20:05:02Z,CNBC,Ashley Capoot,OpenAI closes record-breaking $122 billion funding round as anticipation builds for IPO,"The round totaled $122 billion of committed capital, up from the $110 billion figure that was previously announced.","OpenAI on Tuesday announced that it closed a record-breaking funding round at a post-money valuation of $852 billion. 
The round totaled $122 billion of committed capital, up from the $110 billion f… [+2456 chars]",https://www.cnbc.com/2026/03/31/openai-funding-round-ipo.html
NVDA,2026-03-31T20:03:39Z,The Times of India,Reuters,"US Stocks today: Dow Jones soars 1,125 points, Nasdaq, S&P 3% as Iran war de-escalation seen",Wall Street surged Tuesday as speculation of a de-escalation in the Middle East conflict eased oil price and inflation fears. Major indexes rallied following reports of President Trump's willingness to end military action against Iran. Investors are seeking i…,"Wall Street ended sharply higher on Tuesday, lifted by speculation about a potential de-escalation in the Middle East conflict that has sent oil prices soaring and fueled fears of global inflation in… [+2577 chars]",https://economictimes.indiatimes.com/markets/us-stocks/news/us-stocks-today-dow-jones-soars-1125-points-nasdaq-sp-3-as-iran-war-de-escalation-seen/articleshow/129936055.cms
NVDA,2026-03-31T19:57:54Z,Catenaa.com,malindasp,Super Micro Computer Investors Look for Exits,"Article URL: https://catenaa.com/markets/equities/super-micro-computer-investors-look-for-exits/
Comments URL: https://news.ycombinator.com/item?id=47592626
Points: 4
# Comments: 2","Catenaa, Tuesday, March 31, 2026- Super Micro Computer has its investors looking for exits with the recent self-inflicted wounds by the company, despite soaring sales.
With soaring sales, an enviabl… [+2345 chars]",https://catenaa.com/markets/equities/super-micro-computer-investors-look-for-exits/
NVDA,2026-03-31T19:55:57Z,Moby.co,Mitchell Duran,"Oracle Cuts 29,000 Jobs & Wall Street Throws a Party","After raising $30 billion for cloud expansion for the ongoing AI boom, Oracle turned around and axed nearly 18% of its global workforce.","Oracle Cuts 29,000 Jobs &amp; Wall Street Throws a Party - Moby
Oracle announced Tuesday that it's cutting 18% of its global workforce, and ORCL jumped 6% on the news. Per an SEC filing cited by Reu… [+1869 chars]",https://app.moby.co/home/news/news-oracle-cuts-29000-jobs-wall-street-throws-a-party?utm_source=yahoo_finance&amp;utm_medium=rss
NVDA,2026-03-31T19:42:35Z,Yahoo Entertainment,,Why Did Nvidia Stock Pop Today?,,"If you click 'Accept all', we and our partners, including 251 who are part of the IAB Transparency &amp; Consent Framework, will also store and / or access information on a device (in other words, us… [+1046 chars]",https://consent.yahoo.com/v2/collectConsent?sessionId=1_cc-session_a3820ee7-6af1-480c-8f9a-3d327713f333
NVDA,2026-03-31T19:39:15Z,Forbes,"Antonio Pequeño IV, Forbes Staff, 
 Antonio Pequeño IV, Forbes Staff
 https://www.forbes.com/sites/antoniopequenoiv/",Stock Market Soars To Best Day In 10 Months As Trump Suggests Iran War Won’t Last ‘Much Longer’,"Tuesday marked the indexes’ strongest day of trading since May 12, 2025.","President Donald Trump told the New York Post on Tuesday that U.S. military forces will not need to be in Iran much longer, sending most stocks soaring in what marks a major turnaround for markets th… [+2528 chars]",https://www.forbes.com/sites/antoniopequenoiv/2026/03/31/stock-market-soars-to-best-day-in-10-months-as-trump-suggests-iran-war-wont-last-much-longer/
NVDA,2026-03-31T19:35:04Z,Rlsbb.to,Ash,Let It Be Light 2.0.14,"Description: Let It Be Light – Illuminate the Unseen, Unleash Infinite Content! Tired of missing out on dark, low-light footage that could be your next viral hit? Say hello to Let It Be Light – the revolutionary AI-powered image and video processing software …","Description: Let It Be Light  Illuminate the Unseen, Unleash Infinite Content! Tired of missing out on dark, low-light footage that could be your next viral hit? Say hello to Let It Be Light the revo… [+1988 chars]",https://post.rlsbb.to/let-it-be-light-2-0-14/
NVDA,2026-03-31T19:35:04Z,Rlsbb.to,Ash,Scale Photo Up 2.0.14,"Description: Scale Photo Up – Transform Blurry into Brilliant with AI-Powered Upscaling! Tired of pixelated, low-res footage holding back your creativity? Say goodbye to grainy memories and hello to Scale Photo Up – the game-changing AI software that doubles …","Description: Scale Photo Up  Transform Blurry into Brilliant with AI-Powered Upscaling! Tired of pixelated, low-res footage holding back your creativity? Say goodbye to grainy memories and hello to S… [+2139 chars]",https://post.rlsbb.to/scale-photo-up-2-0-14/
NVDA,2026-03-31T19:33:17Z,Wccftech,Muhammad Zuhair,"NVIDIA CEO Reveals How The Company Survived an “Existential Threat” After Forcing CUDA On Gaming GPUs; Now, It’s Their Biggest Moat","NVIDIA's CEO recalls a pretty interesting moment with the launch of CUDA on GeForce GPUs, saying that it was a bet that could've cost Jensen his company. NVIDIA's CEO Expresses His Gratitude To GeForce Being the Driving Force Behind CUDA It's actually astonis…","NVIDIA's CEO recalls a pretty interesting moment with the launch of CUDA on GeForce GPUs, saying that it was a bet that could've cost Jensen his company. 
It's actually astonishing to see how vital … [+3423 chars]",https://wccftech.com/nvidia-ceo-reveals-how-the-company-survived-an-existential-threat-after-forcing-cuda-on-gaming-gpus/
NVDA,2026-03-31T19:23:28Z,Kotaku,Lewis Parker,Is The RAM AI-pocalypse Finally Over? Probably Not,"RAM manufacturers' stock prices are falling across the board this week, but it's too early to break out the celebratory post-AI-bubble-popping champagne","Its been a big week for AI haters. OpenAIs video platform Sora shut down on March 24 (following a report that it was allegedly losing $1 million every day), some DDR5 RAM prices are currently down (a… [+9307 chars]",https://kotaku.com/ram-ai-stock-prices-bubble-openai-nvidia-chatgpt-2000683539
